10618,An economic evaluation of screening 60- to 70-year-old adults for hearing loss,"BACKGROUND: Hearing loss is common among older adults and has consequences for sufferers, families and society, but there is substantial unmet need for intervention. Screening could expedite intervention and improve outcomes. METHODS: We use Markov models to estimate the incremental cost-effectiveness ratio (ICER) of potential screening programmes compared with current provision (GP-referral), from a health service perspective. Alternative options are investigated through scenario analysis. One-way and probabilistic sensitivity analyses are undertaken. RESULTS: All modelled screens are cost-effective and reduce unmet need for hearing aids. The most cost-effective option identified is a one-stage audiometric screen for bilateral hearing loss >/=30 dB hearing level (HL) at age 60, repeated at ages 65 and 70. This option has an ICER of pound1461 compared to GP-referral and would mean an additional 15 437 adults benefiting from hearing intervention per 100 000 population aged 60. The cost-effectiveness acceptability curve shows that screening is more cost-effective than GP-referral provided a Quality Adjusted Life Year is valued at pound2000 or more. CONCLUSIONS: Adult hearing screening would provide a cost-effective way to improve quality of life for older adults. We recommend piloting an audiometric screen offered to all adults age 60, 65 and 70 years to identify bilateral hearing loss of at least 30 dB HL.",2013-01-09824,23027734,J Public Health (Oxf),A E Morris,2013,35 / 1,,No,23027734,"A E Morris; M E Lutman; A J Cook; D Turner; An economic evaluation of screening 60- to 70-year-old adults for hearing loss, J Public Health (Oxf), 2013 Mar; 35(1):1741-3842",QALY,United Kingdom,Not Stated,Not Stated,"One-stage audiometric screen, offered at age 60 and repeated at 65 and 70 years involving a 3kHz pure tone presented twice to each ear at 35 dB HL (decibels hearing level) by a standard clinical audiometer; a pass is achieved if any of the tones are heard in either ear. If hearing loss is confirmed, one or two hearing aids would be offered vs. Existing general practitioner (GP)-referral service, which requires adults to request an appointment with their GP and for their GP to refer for audiological assessment, where pure tone audiometry (PTA) is performed",Not Stated,64 Years,41 Years,"Female, Male",Full,25 Years,3.50,3.50,1787,United Kingdom,2010,3274.36
10619,An economic evaluation of screening 60- to 70-year-old adults for hearing loss,"BACKGROUND: Hearing loss is common among older adults and has consequences for sufferers, families and society, but there is substantial unmet need for intervention. Screening could expedite intervention and improve outcomes. METHODS: We use Markov models to estimate the incremental cost-effectiveness ratio (ICER) of potential screening programmes compared with current provision (GP-referral), from a health service perspective. Alternative options are investigated through scenario analysis. One-way and probabilistic sensitivity analyses are undertaken. RESULTS: All modelled screens are cost-effective and reduce unmet need for hearing aids. The most cost-effective option identified is a one-stage audiometric screen for bilateral hearing loss >/=30 dB hearing level (HL) at age 60, repeated at ages 65 and 70. This option has an ICER of pound1461 compared to GP-referral and would mean an additional 15 437 adults benefiting from hearing intervention per 100 000 population aged 60. The cost-effectiveness acceptability curve shows that screening is more cost-effective than GP-referral provided a Quality Adjusted Life Year is valued at pound2000 or more. CONCLUSIONS: Adult hearing screening would provide a cost-effective way to improve quality of life for older adults. We recommend piloting an audiometric screen offered to all adults age 60, 65 and 70 years to identify bilateral hearing loss of at least 30 dB HL.",2013-01-09824,23027734,J Public Health (Oxf),A E Morris,2013,35 / 1,,No,23027734,"A E Morris; M E Lutman; A J Cook; D Turner; An economic evaluation of screening 60- to 70-year-old adults for hearing loss, J Public Health (Oxf), 2013 Mar; 35(1):1741-3842",QALY,United Kingdom,Not Stated,Not Stated,"Two-stage screen involving a postal questionnaire sent to all eligible adults followed by invitation to audiometric screen (for 35 decibels hearing level) for those who fail the questionnaire screen, offered at age 60 and repeated at 65 and 70 years. If hearing loss is confirmed, one or two hearing aids would be offered. vs. Existing general practitioner (GP)-referral service, which requires adults to request an appointment with their GP and for their GP to refer for audiological assessment where pure tone audiometry (PTA) is performed",Not Stated,64 Years,41 Years,"Female, Male",Full,25 Years,3.50,3.50,1858.05,United Kingdom,2010,3404.54
10620,An economic evaluation of screening 60- to 70-year-old adults for hearing loss,"BACKGROUND: Hearing loss is common among older adults and has consequences for sufferers, families and society, but there is substantial unmet need for intervention. Screening could expedite intervention and improve outcomes. METHODS: We use Markov models to estimate the incremental cost-effectiveness ratio (ICER) of potential screening programmes compared with current provision (GP-referral), from a health service perspective. Alternative options are investigated through scenario analysis. One-way and probabilistic sensitivity analyses are undertaken. RESULTS: All modelled screens are cost-effective and reduce unmet need for hearing aids. The most cost-effective option identified is a one-stage audiometric screen for bilateral hearing loss >/=30 dB hearing level (HL) at age 60, repeated at ages 65 and 70. This option has an ICER of pound1461 compared to GP-referral and would mean an additional 15 437 adults benefiting from hearing intervention per 100 000 population aged 60. The cost-effectiveness acceptability curve shows that screening is more cost-effective than GP-referral provided a Quality Adjusted Life Year is valued at pound2000 or more. CONCLUSIONS: Adult hearing screening would provide a cost-effective way to improve quality of life for older adults. We recommend piloting an audiometric screen offered to all adults age 60, 65 and 70 years to identify bilateral hearing loss of at least 30 dB HL.",2013-01-09824,23027734,J Public Health (Oxf),A E Morris,2013,35 / 1,,No,23027734,"A E Morris; M E Lutman; A J Cook; D Turner; An economic evaluation of screening 60- to 70-year-old adults for hearing loss, J Public Health (Oxf), 2013 Mar; 35(1):1741-3842",QALY,United Kingdom,Not Stated,Not Stated,"One-stage audiometric screen, offered at age 60 and repeated at 65 and 70 years involving a 3kHz pure tone presented twice to each ear at 30 dB HL (decibels hearing level) by a standard clinical audiometer; a pass is achieved if any of the tones are heard in either ear. If hearing loss is confirmed, one or two hearing aids would be offered vs. Existing general practitioner (GP)-referral service, which requires adults to request an appointment with their GP and for their GP to refer for audiological assessment, where pure tone audiometry (PTA) is performed",Not Stated,64 Years,41 Years,"Female, Male",Full,25 Years,3.50,3.50,1461,United Kingdom,2010,2677.02
10621,Mortality and treatment costs have a great impact on the cost-effectiveness of disease modifying treatment in Alzheimer's disease--a simulation study,"BACKGROUND: The societal costs of Alzheimer''s Disease (AD) are enormous and pose a great challenge for the health and social care in any society. It is of vital importance to develop and identify cost effective treatment. The aim of the study was to present a hypothetical economic model of Disease Modifying Treatment (DMT) in AD. METHODS: A 20 year Markov cohort model of DMT was constructed, based on Swedish care conditions. States and progression were defined according to the Mini Mental State Examination (MMSE). Epidemiological studies of incidence of dementia, prevalence and costs of Mild Cognitive Impairment (MCI) and AD as well as conversion studies of MCI and demographic statistics were used as inputs in the model. RESULTS: Total costs were 113,797 million SEK for patients treated with DMT vs 88,562 million SEK for untreated patients. The corresponding gained QALYs were 529,945 and 450,307 respectively, giving an incremental cost effectiveness ratio of 293,002 SEK/QALY in the base option. Survival in the model was 8.72 years with DMT and 7.77 years for untreated. With an assumed Willingness to pay (WTP) of 600,000 SEK (about 86,200 US$ and 62,000 ) per gained QALY, the model indicated cost effectiveness with DMT. The sensitivity analysis implied no cost savings with DMT, but most options indicated cost effectiveness vs. the chosen WTP. CONCLUSION: The main reasons for the higher costs with DMT were the costs of DMT itself and the prolonged survival with DMT. Even if costs increase with DMT, the model indicates cost effectiveness.",2013-01-09903,23036018,Curr Alzheimer Res,Anders Skoldunger,2013,10 / 2,,No,23036018,"Anders Skoldunger; Kristina Johnell; Bengt Winblad; Anders Wimo; Mortality and treatment costs have a great impact on the cost-effectiveness of disease modifying treatment in Alzheimer's disease--a simulation study, Curr Alzheimer Res, 2013 Feb; 10(2):1875-5828",QALY,Sweden,Not Stated,Not Stated,Hypothetical Disease Modifying Treatment (DMT) - immunization therapy or treatment with secetase inhibitors vs. None,Not Stated,Not Stated,65 Years,"Female, Male",Full,20 Years,3.00,3.00,293002,Sweden,2005,52140.71
10622,The price of emergency contraception in the United States: what is the cost-effectiveness of ulipristal acetate versus single-dose levonorgestrel?,"BACKGROUND: Ulipristal acetate (UPA) is a novel form of emergency contraception (EC) that appears to be more effective than the prevailing method, single-dose levonorgestrel (LNG). This study examines the cost-efficacy of UPA compared with LNG. STUDY DESIGN: A decision-analytic model was developed to compare the cost-effectiveness of UPA versus LNG in preventing unintended pregnancy when taken within 120 h of unprotected intercourse. Univariate and bivariate sensitivity analyses, as well as Monte Carlo simulation and threshold analyses, were performed. RESULTS: Utilizing UPA instead of LNG would result in 37,589 fewer unintended pregnancies per 4,176,572 estimated US annual EC uses (UPA 54,295 pregnancies; LNG 91,884 pregnancies) and a societal savings of $116.3 million annually. Cost-effectiveness acceptability curve analyses suggest a 96% probability that UPA is more cost-effective at a willingness to pay $100,000 per quality-adjusted life year. CONCLUSIONS: UPA is cost-effective in preventing unintended pregnancy after unprotected intercourse. Efforts should be promoted to increase access to UPA.",2013-01-09906,23040122,Contraception,Lisa L Bayer,2013,87 / 3,,No,23040122,"Lisa L Bayer; Alison B Edelman; Aaron B Caughey; Maria I Rodriguez; The price of emergency contraception in the United States: what is the cost-effectiveness of ulipristal acetate versus single-dose levonorgestrel?, Contraception, 2013 Mar; 87(3):0010-7824",QALY,United States of America,Not Stated,Not Stated,Ulipristal acetate (UPA) - single dose (30 mg) taken within 120 hours of unprotected intercourse vs. Single-dose levonorgestrel (LNG) taken within 120 hours of unprotected intercourse,emergency contraception (EC) users,Not Stated,19 Years,Female,Full,55 Years,3.00,3.00,-14436.82,United States,2011,-16610.76
10623,Health benefits and cost effectiveness of endoscopic and nonendoscopic cytosponge screening for Barrett's esophagus,"BACKGROUND & AIMS: We developed a model to compare the health benefits and cost effectiveness of screening for Barrett''s esophagus by either Cytosponge or by conventional endoscopy vs no screening, and to estimate their abilities to reduce mortality from esophageal adenocarcinoma. METHODS: We used microsimulation modeling of a hypothetical cohort of 50-year-old men in the United Kingdom with histories of gastroesophageal reflux disease symptoms, assuming the prevalence of Barrett''s esophagus to be 8%. Participants were invited to undergo screening by endoscopy or Cytosponge (invitation acceptance rates of 23% and 45%, respectively), and outcomes were compared with those from men who underwent no screening. We estimated the number of incident esophageal adenocarcinoma cases prevented and the incremental cost-effectiveness ratio of quality-adjusted life years (QALYs) of the different strategies. Patients found to have high-grade dysplasia or intramucosal cancer received endotherapy. Model inputs included data on disease progression, test accuracy, post-treatment status, and surveillance protocols. Costs and benefits were discounted at 3.5% per year. Supplementary and sensitivity analyses comprised esophagectomy management of high-grade dysplasia or intramucosal cancer, screening by ultrathin nasal endoscopy, and different assumptions of uptake of screening invitations for either strategy. RESULTS: We estimated that compared with no screening, Cytosponge screening followed by treatment of patients with dysplasia or intramucosal cancer costs an additional $240 (95% credible interval, $196-$320) per screening participant and results in a mean gain of 0.015 (95% credible interval, -0.001 to 0.029) QALYs and an incremental cost-effectiveness ratio of $15.7 thousand (K) per QALY. The respective values for endoscopy were $299 ($261-$367), 0.013 (0.003-0.023) QALYs, and $22.2K. Screening by the Cytosponge followed by treatment of patients with dysplasia or intramucosal cancer would reduce the number of cases of incident symptomatic esophageal adenocarcinoma by 19%, compared with 17% for screening by endoscopy, although this greater benefit for Cytosponge depends on more patients accepting screening by Cytosponge compared with screening by endoscopy. CONCLUSIONS: In a microsimulation model, screening 50-year-old men with symptoms of gastroesophageal reflux disease by Cytosponge is cost effective and would reduce mortality from esophageal adenocarcinoma compared with no screening.",2013-01-09911,23041329,Gastroenterology,Tatiana Benaglia,2013,144 / 1,62-73.e6,No,23041329,"Tatiana Benaglia; Linda D Sharples; Rebecca C Fitzgerald; Georgios Lyratzopoulos; Health benefits and cost effectiveness of endoscopic and nonendoscopic cytosponge screening for Barrett's esophagus, Gastroenterology, ; 144(1):0016-5085; 62-73.e6",QALY,United Kingdom,Not Stated,Not Stated,Cytosponge screening for Barrett's esophagus followed by endotherapy vs. None,"Age- 50 years, Barrett's prevalence of 8%",64 Years,41 Years,Male,Full,50 Years,3.50,3.50,15724,United States,2007,19627.21
10624,Health benefits and cost effectiveness of endoscopic and nonendoscopic cytosponge screening for Barrett's esophagus,"BACKGROUND & AIMS: We developed a model to compare the health benefits and cost effectiveness of screening for Barrett''s esophagus by either Cytosponge or by conventional endoscopy vs no screening, and to estimate their abilities to reduce mortality from esophageal adenocarcinoma. METHODS: We used microsimulation modeling of a hypothetical cohort of 50-year-old men in the United Kingdom with histories of gastroesophageal reflux disease symptoms, assuming the prevalence of Barrett''s esophagus to be 8%. Participants were invited to undergo screening by endoscopy or Cytosponge (invitation acceptance rates of 23% and 45%, respectively), and outcomes were compared with those from men who underwent no screening. We estimated the number of incident esophageal adenocarcinoma cases prevented and the incremental cost-effectiveness ratio of quality-adjusted life years (QALYs) of the different strategies. Patients found to have high-grade dysplasia or intramucosal cancer received endotherapy. Model inputs included data on disease progression, test accuracy, post-treatment status, and surveillance protocols. Costs and benefits were discounted at 3.5% per year. Supplementary and sensitivity analyses comprised esophagectomy management of high-grade dysplasia or intramucosal cancer, screening by ultrathin nasal endoscopy, and different assumptions of uptake of screening invitations for either strategy. RESULTS: We estimated that compared with no screening, Cytosponge screening followed by treatment of patients with dysplasia or intramucosal cancer costs an additional $240 (95% credible interval, $196-$320) per screening participant and results in a mean gain of 0.015 (95% credible interval, -0.001 to 0.029) QALYs and an incremental cost-effectiveness ratio of $15.7 thousand (K) per QALY. The respective values for endoscopy were $299 ($261-$367), 0.013 (0.003-0.023) QALYs, and $22.2K. Screening by the Cytosponge followed by treatment of patients with dysplasia or intramucosal cancer would reduce the number of cases of incident symptomatic esophageal adenocarcinoma by 19%, compared with 17% for screening by endoscopy, although this greater benefit for Cytosponge depends on more patients accepting screening by Cytosponge compared with screening by endoscopy. CONCLUSIONS: In a microsimulation model, screening 50-year-old men with symptoms of gastroesophageal reflux disease by Cytosponge is cost effective and would reduce mortality from esophageal adenocarcinoma compared with no screening.",2013-01-09911,23041329,Gastroenterology,Tatiana Benaglia,2013,144 / 1,62-73.e6,No,23041329,"Tatiana Benaglia; Linda D Sharples; Rebecca C Fitzgerald; Georgios Lyratzopoulos; Health benefits and cost effectiveness of endoscopic and nonendoscopic cytosponge screening for Barrett's esophagus, Gastroenterology, ; 144(1):0016-5085; 62-73.e6",QALY,United Kingdom,Not Stated,Not Stated,Endoscopy screening for Barrett's esophagus followed by endotherapy vs. None,"Age- 50 years, Barrett's prevalence of 8%",64 Years,41 Years,Male,Full,50 Years,3.50,3.50,22167,United States,2007,27669.57
10625,Health benefits and cost effectiveness of endoscopic and nonendoscopic cytosponge screening for Barrett's esophagus,"BACKGROUND & AIMS: We developed a model to compare the health benefits and cost effectiveness of screening for Barrett''s esophagus by either Cytosponge or by conventional endoscopy vs no screening, and to estimate their abilities to reduce mortality from esophageal adenocarcinoma. METHODS: We used microsimulation modeling of a hypothetical cohort of 50-year-old men in the United Kingdom with histories of gastroesophageal reflux disease symptoms, assuming the prevalence of Barrett''s esophagus to be 8%. Participants were invited to undergo screening by endoscopy or Cytosponge (invitation acceptance rates of 23% and 45%, respectively), and outcomes were compared with those from men who underwent no screening. We estimated the number of incident esophageal adenocarcinoma cases prevented and the incremental cost-effectiveness ratio of quality-adjusted life years (QALYs) of the different strategies. Patients found to have high-grade dysplasia or intramucosal cancer received endotherapy. Model inputs included data on disease progression, test accuracy, post-treatment status, and surveillance protocols. Costs and benefits were discounted at 3.5% per year. Supplementary and sensitivity analyses comprised esophagectomy management of high-grade dysplasia or intramucosal cancer, screening by ultrathin nasal endoscopy, and different assumptions of uptake of screening invitations for either strategy. RESULTS: We estimated that compared with no screening, Cytosponge screening followed by treatment of patients with dysplasia or intramucosal cancer costs an additional $240 (95% credible interval, $196-$320) per screening participant and results in a mean gain of 0.015 (95% credible interval, -0.001 to 0.029) QALYs and an incremental cost-effectiveness ratio of $15.7 thousand (K) per QALY. The respective values for endoscopy were $299 ($261-$367), 0.013 (0.003-0.023) QALYs, and $22.2K. Screening by the Cytosponge followed by treatment of patients with dysplasia or intramucosal cancer would reduce the number of cases of incident symptomatic esophageal adenocarcinoma by 19%, compared with 17% for screening by endoscopy, although this greater benefit for Cytosponge depends on more patients accepting screening by Cytosponge compared with screening by endoscopy. CONCLUSIONS: In a microsimulation model, screening 50-year-old men with symptoms of gastroesophageal reflux disease by Cytosponge is cost effective and would reduce mortality from esophageal adenocarcinoma compared with no screening.",2013-01-09911,23041329,Gastroenterology,Tatiana Benaglia,2013,144 / 1,62-73.e6,No,23041329,"Tatiana Benaglia; Linda D Sharples; Rebecca C Fitzgerald; Georgios Lyratzopoulos; Health benefits and cost effectiveness of endoscopic and nonendoscopic cytosponge screening for Barrett's esophagus, Gastroenterology, ; 144(1):0016-5085; 62-73.e6",QALY,United Kingdom,Not Stated,Not Stated,Endoscopy screening for Barrett's esophagus followed by endotherapy vs. Cytosponge screening for Barrett's esophagus followed by endotherapy,"Age - 50 years, Barrett's prevalence of 8%",64 Years,41 Years,Male,Full,50 Years,3.50,3.50,-29000,United States,2007,-36198.74
10626,Blood salvage produces higher total blood product costs in single-level lumbar spine surgery,"STUDY DESIGN: Retrospective review. OBJECTIVE: To determine the incremental cost-effectiveness of cell saver for single-level posterior lumbar decompression and fusion (PLDF). SUMMARY OF BACKGROUND DATA: Intraoperative cell salvage is used during surgery to reduce the need for perioperative allogeneic blood transfusion. Although the use of cell saver may be beneficial in certain circumstances, its utility has not been clearly established for the common procedure of an adult single-level PLDF. METHODS: Randomly selected adult patients treated with a single-level PLDF between July 2010 and June 2011 at a single institution were identified. Patients who had a combined anterior and posterior approach were excluded. The final study sample for analysis consisted of 180 patients. Hospital records were reviewed to determine whether: (1) cell saver was available during surgery, (2) recovered autologous blood was infused, and (3) the patient received intra- or postoperative allogeneic transfusions. Estimated blood loss, levels fused, volume(s) transfused, and all related complications were recorded. Costs included the cost of allogeneic blood transfusion, setting up the cell saver recovery system, and infusing autologous blood from cell saver, whereas effectiveness measures were allogeneic blood transfusions averted and quality adjusted life years. RESULTS: The incremental cost-effectiveness ratio was $55,538 per allogeneic transfusion averted, with a decrease in the transfusion rate from 40.0% to 38.7% associated with the cell saver approach. This translated into an incremental cost-effectiveness ratio of $5,555,380 per quality adjusted life years gained, which is well above the threshold for an intervention to be considered cost-effective ($100,000 per quality adjusted life years gained). CONCLUSION: The use of cell saver during a single-level PLDF does not significantly reduce the need for allogeneic blood transfusion and is not cost-effective. The high cost of cell saver in combination with the low complication rate of allogeneic blood transfusion, suggest that cell saver should not be used for single-level PLDF. Further studies are needed to evaluate the necessity for cell saver among other types of spinal surgery.",2013-01-09917,23044618,Spine (Phila Pa 1976) Spine (Phila Pa 1976),Chelsea E Canan,2013,38 / 8,,No,23044618,"Chelsea E Canan; John A Myers; Roger Kirk Owens; Charles H 3rd Crawford; Mladen Djurasovic; Lauren O Burke; Kelly R Bratcher; Kathryn J McCarthy; Leah Y Carreon; Blood salvage produces higher total blood product costs in single-level lumbar spine surgery, Spine (Phila Pa 1976) Spine (Phila Pa 1976) , ; 38(8):1528-1159",QALY,United States of America,Not Stated,Not Stated,Cell saver available during surgery (intraoperative cell salvage for autologous cell saver transfusion) vs. No cell saver available for surgery,treated with a single-level posterior lumbar decompression and fusion (PLDF),Not Stated,19 Years,"Female, Male",Full,Not Stated / None,Not Stated,Not Stated,5553846,United States,2011,6390161.05
