15526,Cost Effectiveness of First-Line Oral Therapies for Pulmonary Arterial Hypertension: A Modelling Study,"BACKGROUND: In recent years, a significant number of costly oral therapies have become available for the treatment of pulmonary arterial hypertension (PAH). Funding decisions for these therapies requires weighing up their effectiveness and costs. OBJECTIVE: The aim of this study was to assess the cost effectiveness of monotherapy with oral PAH-specific therapies versus supportive care as initial therapy for patients with functional class (FC) II and III PAH in Canada. METHODS: A cost-utility analysis, from the perspective of a healthcare system and based on a Markov model, was designed to estimate the costs and quality-adjusted life-years (QALYs) associated with bosentan, ambrisentan, riociguat, tadalafil, sildenafil and supportive care for PAH in treatment-naive patients. Separate analyses were conducted for cohorts of patients commencing therapy at FC II and III PAH. Transition probabilities, based on the relative risk of improving and worsening in FC with treatment versus placebo, were derived from a recent network meta-analysis. Utility values and costs were obtained from published data and clinical expert opinion. Extensive sensitivity analyses were conducted. RESULTS: Analysis suggests that sildenafil is the most cost-effective therapy for PAH in patients with FC II or III. Sildenafil was both the least costly and most effective therapy, thereby dominating all other treatments. Tadalafil was also less costly and more effective than supportive care in FC II and III; however, sildenafil was dominant over tadalafil. Even given the uncertainty within the clinical inputs, the probabilistic sensitivity analysis showed that apart from sildenafil and tadalafil, the other PAH therapies had negligible probability of being the most cost effective. CONCLUSION: The results show that initiation of therapy with sildenafil is likely the most cost-effective strategy in PAH patients with either FC II or III disease.",2016-01-20369,26739957,Pharmacoeconomics,Kathryn Coyle,2016,34 / 5,509-20,Yes,26739957,"Kathryn Coyle; Doug Coyle; Julie Blouin; Karen Lee; Mohammed F Jabr; Khai Tran; Lisa Mielniczuk; John Swiston; Mike Innes; Cost Effectiveness of First-Line Oral Therapies for Pulmonary Arterial Hypertension: A Modelling Study, Pharmacoeconomics, 2016 May; 34(5):1179-2027; 509-20",QALY,Canada,Not Stated,Not Stated,Sildenafil vs. Standard/Usual Care- Riocigaut,Pulmonary arterial hypertension (PAH) Functional class III,Not Stated,19 Years,"Female, Male",Full,Lifetime,5.00,5.00,-847125.56,Canada,2013,-914067.13
15527,Cost Effectiveness of First-Line Oral Therapies for Pulmonary Arterial Hypertension: A Modelling Study,"BACKGROUND: In recent years, a significant number of costly oral therapies have become available for the treatment of pulmonary arterial hypertension (PAH). Funding decisions for these therapies requires weighing up their effectiveness and costs. OBJECTIVE: The aim of this study was to assess the cost effectiveness of monotherapy with oral PAH-specific therapies versus supportive care as initial therapy for patients with functional class (FC) II and III PAH in Canada. METHODS: A cost-utility analysis, from the perspective of a healthcare system and based on a Markov model, was designed to estimate the costs and quality-adjusted life-years (QALYs) associated with bosentan, ambrisentan, riociguat, tadalafil, sildenafil and supportive care for PAH in treatment-naive patients. Separate analyses were conducted for cohorts of patients commencing therapy at FC II and III PAH. Transition probabilities, based on the relative risk of improving and worsening in FC with treatment versus placebo, were derived from a recent network meta-analysis. Utility values and costs were obtained from published data and clinical expert opinion. Extensive sensitivity analyses were conducted. RESULTS: Analysis suggests that sildenafil is the most cost-effective therapy for PAH in patients with FC II or III. Sildenafil was both the least costly and most effective therapy, thereby dominating all other treatments. Tadalafil was also less costly and more effective than supportive care in FC II and III; however, sildenafil was dominant over tadalafil. Even given the uncertainty within the clinical inputs, the probabilistic sensitivity analysis showed that apart from sildenafil and tadalafil, the other PAH therapies had negligible probability of being the most cost effective. CONCLUSION: The results show that initiation of therapy with sildenafil is likely the most cost-effective strategy in PAH patients with either FC II or III disease.",2016-01-20369,26739957,Pharmacoeconomics,Kathryn Coyle,2016,34 / 5,509-20,Yes,26739957,"Kathryn Coyle; Doug Coyle; Julie Blouin; Karen Lee; Mohammed F Jabr; Khai Tran; Lisa Mielniczuk; John Swiston; Mike Innes; Cost Effectiveness of First-Line Oral Therapies for Pulmonary Arterial Hypertension: A Modelling Study, Pharmacoeconomics, 2016 May; 34(5):1179-2027; 509-20",QALY,Canada,Not Stated,Not Stated,Sildenafil vs. Standard/Usual Care- Bosentan,Pulmonary arterial hypertension (PAH) Functional class III,Not Stated,19 Years,"Female, Male",Full,Lifetime,5.00,5.00,-715617.31,Canada,2013,-772166.84
15528,Cost-effectiveness Analysis of Follow-up Strategies for Thunderclap Headache Patients With Negative Noncontrast CT,"OBJECTIVES: Accurate diagnosis of acute subarachnoid hemorrhage (SAH) is critical in thunderclap headache patients due to high morbidity and mortality associated with missed aneurysmal bleeds. The objective of this study was to determine the utility of computed tomography angiography (CTA) in managing patients with acute, severe headaches and negative noncontrast CT and assess the cost-effectiveness of three different screening strategies-no follow up, CTA, and lumbar puncture (LP). METHODS: A modeling-based economic evaluation was performed with a time horizon of 1 year for thunderclap headache patients in the emergency department with negative noncontrast CT for SAH. Sensitivity analyses were performed to determine the effect of sensitivity of CT and the prevalence of SAH on cost-effectiveness. RESULTS: Lumbar puncture follow-up has the lowest cost and the highest utility in the mathematical model. The Monte Carlo simulation shows noncontrast CT with LP follow-up to be the most cost-effective strategy in 85.3% of all cases even at a $1 million/quality-adjusted life-years willingness-to-pay. Sensitivity analyses demonstrate that LP follow-up should be performed, except for when CT sensitivity exceeds 99.2% and the SAH prevalence is below 3.2%, where no follow-up may be considered. CONCLUSIONS: Although CTA is frequently used for evaluation of thunderclap headache patients, its utility is not clearly defined. LP follow-up is shown to be the most cost-effective strategy for evaluation of thunderclap headache patients in most clinical settings.",2016-01-20384,26728524,Acad Emerg Med,Ajay Malhotra,2016,23 / 3,243-50,No,26728524,"Ajay Malhotra; Xiao Wu; Vivek B Kalra; Joseph Schindler; Howard P Forman; Cost-effectiveness Analysis of Follow-up Strategies for Thunderclap Headache Patients With Negative Noncontrast CT, Acad Emerg Med, 2016 Mar; 23(3):1069-6563; 243-50",QALY,United States of America,Not Stated,Not Stated,Computed tomography angiography (CTA) vs. No follow up,Negative initial CT,Not Stated,19 Years,"Female, Male",Full,1 Year,Not Stated,Not Stated,1409999.88,United States,2014,1541478.6
15529,Cost-effectiveness Analysis of Follow-up Strategies for Thunderclap Headache Patients With Negative Noncontrast CT,"OBJECTIVES: Accurate diagnosis of acute subarachnoid hemorrhage (SAH) is critical in thunderclap headache patients due to high morbidity and mortality associated with missed aneurysmal bleeds. The objective of this study was to determine the utility of computed tomography angiography (CTA) in managing patients with acute, severe headaches and negative noncontrast CT and assess the cost-effectiveness of three different screening strategies-no follow up, CTA, and lumbar puncture (LP). METHODS: A modeling-based economic evaluation was performed with a time horizon of 1 year for thunderclap headache patients in the emergency department with negative noncontrast CT for SAH. Sensitivity analyses were performed to determine the effect of sensitivity of CT and the prevalence of SAH on cost-effectiveness. RESULTS: Lumbar puncture follow-up has the lowest cost and the highest utility in the mathematical model. The Monte Carlo simulation shows noncontrast CT with LP follow-up to be the most cost-effective strategy in 85.3% of all cases even at a $1 million/quality-adjusted life-years willingness-to-pay. Sensitivity analyses demonstrate that LP follow-up should be performed, except for when CT sensitivity exceeds 99.2% and the SAH prevalence is below 3.2%, where no follow-up may be considered. CONCLUSIONS: Although CTA is frequently used for evaluation of thunderclap headache patients, its utility is not clearly defined. LP follow-up is shown to be the most cost-effective strategy for evaluation of thunderclap headache patients in most clinical settings.",2016-01-20384,26728524,Acad Emerg Med,Ajay Malhotra,2016,23 / 3,243-50,No,26728524,"Ajay Malhotra; Xiao Wu; Vivek B Kalra; Joseph Schindler; Howard P Forman; Cost-effectiveness Analysis of Follow-up Strategies for Thunderclap Headache Patients With Negative Noncontrast CT, Acad Emerg Med, 2016 Mar; 23(3):1069-6563; 243-50",QALY,United States of America,Not Stated,Not Stated,Computed tomography angiography (CTA) vs. Standard/Usual Care- Lumbar puncture (LP),Negative initial CT,Not Stated,19 Years,"Female, Male",Full,1 Year,Not Stated,Not Stated,-43333.33,United States,2014,-47374.05
15530,A Cost-Effectiveness Comparison Between Open Transforaminal and Minimally Invasive Lateral Lumbar Interbody Fusions Using the Incremental Cost-Effectiveness Ratio at 2-Year Follow-up,"BACKGROUND: Direct cost comparisons between minimally invasive spine surgeries and the open options are rare. OBJECTIVE: To compare healthcare costs associated with open transforaminal lumbar interbody fusion (TLIF) and minimally invasive lateral lumbar interbody fusion (LLIF) by calculating the incremental cost-effectiveness ratio (ICER) and to calculate the thresholds for minimum clinically important difference and minimum cost-effective difference for patient-reported outcome measures at the 2-year follow-up. METHODS: Forty-five patients who underwent single-level TLIF and 29 patients who underwent single-level stand-alone LLIF were included in the comparison. All costs from diagnosis through the 2-year follow-up were available from a comprehensive single-center data bank within a unified hospital system. Payment provided for all spine-related medical resource use from the time of diagnosis through 2 years was recorded. A 0% discount rate was applied. Quality-adjusted life-years (QALYs) were calculated from the EuroQol-5D collected in an unbiased manner. Difference in total cost per QALY gained for LLIF minus that for TLIF was assessed as the estimate of the ICER from a US perspective. RESULTS: Significant improvements were observed at the 2-year follow-up for both TLIF and LLIF with the Short Form-36 physical component summary, Oswestry Disability Index, visual analog scale back pain and leg pain scores, and EuroQol-5D. ICER calculations revealed similar mean cumulative QALYs gained at the 2-year interval (0.67 for TLIF and 0.60 for LLIF; P = .33). Median total costs of care after TLIF and LLIF were $44 068 and $45 574, respectively (P = .96). Minimum cost-effective difference thresholds with an anchor of <$50 000 per QALY were higher than minimum clinically important difference thresholds for all patient-reported outcome measures. Total mean cost and EuroQol-5D were statistically equivalent between the 2 treatment groups. CONCLUSION: TLIF and LLIF produced equivalent 2-year patient outcomes at an equivalent cost-effectiveness profile. ABBREVIATIONS: AUC, area under the curveBP, back painEQ-5D, EuroQol-5DHTI, Health Transition IndexICER, incremental cost-effectiveness ratioLLIF, lateral lumbar interbody fusionLP, leg painMCED, minimum cost-effective differenceMCID, minimum clinically important differenceMCS, mental component summaryODI, Oswestry Disability IndexPCS, physical component summaryPRO, patient-reported outcomeQALY, quality-adjusted life-yearSF-36, Short Form-36TLIF, transforaminal lumbar interbody fusionVAS, visual analog scale.",2016-01-20389,26726969,Neurosurgery,Gurpreet S Gandhoke,2016,78 / 4,585-95,No,26726969,"Gurpreet S Gandhoke; Han Moe Shin; Yue-Fang Chang; Zachary Tempel; Peter C Gerszten; David O Okonkwo; Adam S Kanter; A Cost-Effectiveness Comparison Between Open Transforaminal and Minimally Invasive Lateral Lumbar Interbody Fusions Using the Incremental Cost-Effectiveness Ratio at 2-Year Follow-up, Neurosurgery, 2016 Apr; 78(4):0148-396X; 585-95",QALY,United States of America,Not Stated,Not Stated,Lateral lumbar interbody fusion (LLIF) vs. Standard/Usual Care- Transforaminal lumbar interbody fusiton (TLIF),Not Stated,82 Years,27 Years,"Female, Male",Full,2 Years,Not Stated,Not Stated,35347,United States,2013,39269.88
15531,The cost-effectiveness of surgical resection and cesium-131 intraoperative brachytherapy versus surgical resection and stereotactic radiosurgery in the treatment of metastatic brain tumors,"This study aims to evaluate the cost-effectiveness of surgical resection (S) and Cesium-131 (Cs-131) [S + Cs-131] intraoperative brachytherapy versus S and stereotactic radiosurgery (SRS) [S + SRS] for the treatment of brain metastases. Treatment records as well as hospital and outpatient charts of 49 patients with brain metastases between 2008 and 2012 who underwent S + Cs-131 (n = 24) and S + SRS (n = 25) were retrospectively reviewed. Hospital charges were compared for the single treatment in question. Means and curves of survival time were defined by the Kaplan-Meier estimator, with the cost analysis focusing on the time period of the relevant treatment. Quality adjusted life years (QALY) and Incremental cost-effectiveness ratios (ICER) were calculated for each treatment option as a measure of cost-effectiveness. The direct hospital costs of treatments per patient were: S + Cs131 = $19,271 and S + SRS = $44,219. The median survival times of S + Cs-131 and S + SRS were 15.5 and 11.3 months, and the 12 month survival rates were 61 % and 49 % (P = 0.137). The QALY for S + SRS when compared to S + Cs-131 yielded a p < 0.0001, making it significantly more cost-effective. The ICER also revealed that when compared to S + Cs-131, S + SRS was significantly inferior (p < 0.0001). S + Cs-131 is more cost-effective compared with S + SRS based on hospital charges as well as QALYs and ICER. Cost effectiveness, in addition to efficacy and risk, should factor into the comparison between these two treatment modalities for patients with surgically resectable brain metastases.",2016-01-20392,26725100,J Neurooncol,A Gabriella Wernicke,2016,127 / 1,145-53,No,26725100,"A Gabriella Wernicke; Menachem Z Yondorf; Bhupesh Parashar; Dattatreyudu Nori; K S Clifford Chao; John A Boockvar; Susan Pannullo; Philip Stieg; Theodore H Schwartz; The cost-effectiveness of surgical resection and cesium-131 intraoperative brachytherapy versus surgical resection and stereotactic radiosurgery in the treatment of metastatic brain tumors, J Neurooncol, 2016 Mar; 127(1):0167-594X; 145-53",QALY,United States of America,Not Stated,Not Stated,surgical resection (S) and Cesium-131 (Cs-131) vs. Standard/Usual Care- surgical resection (S) and stereotactic radiosurgery (SRS) [S+SRS],Not Stated,84 Years,32 Years,"Female, Male",Full,Lifetime,Not Stated,Not Stated,-80477.42,United States,2014,-87981.73
15532,The cost-effectiveness of surgical resection and cesium-131 intraoperative brachytherapy versus surgical resection and stereotactic radiosurgery in the treatment of metastatic brain tumors,"This study aims to evaluate the cost-effectiveness of surgical resection (S) and Cesium-131 (Cs-131) [S + Cs-131] intraoperative brachytherapy versus S and stereotactic radiosurgery (SRS) [S + SRS] for the treatment of brain metastases. Treatment records as well as hospital and outpatient charts of 49 patients with brain metastases between 2008 and 2012 who underwent S + Cs-131 (n = 24) and S + SRS (n = 25) were retrospectively reviewed. Hospital charges were compared for the single treatment in question. Means and curves of survival time were defined by the Kaplan-Meier estimator, with the cost analysis focusing on the time period of the relevant treatment. Quality adjusted life years (QALY) and Incremental cost-effectiveness ratios (ICER) were calculated for each treatment option as a measure of cost-effectiveness. The direct hospital costs of treatments per patient were: S + Cs131 = $19,271 and S + SRS = $44,219. The median survival times of S + Cs-131 and S + SRS were 15.5 and 11.3 months, and the 12 month survival rates were 61 % and 49 % (P = 0.137). The QALY for S + SRS when compared to S + Cs-131 yielded a p < 0.0001, making it significantly more cost-effective. The ICER also revealed that when compared to S + Cs-131, S + SRS was significantly inferior (p < 0.0001). S + Cs-131 is more cost-effective compared with S + SRS based on hospital charges as well as QALYs and ICER. Cost effectiveness, in addition to efficacy and risk, should factor into the comparison between these two treatment modalities for patients with surgically resectable brain metastases.",2016-01-20392,26725100,J Neurooncol,A Gabriella Wernicke,2016,127 / 1,145-53,No,26725100,"A Gabriella Wernicke; Menachem Z Yondorf; Bhupesh Parashar; Dattatreyudu Nori; K S Clifford Chao; John A Boockvar; Susan Pannullo; Philip Stieg; Theodore H Schwartz; The cost-effectiveness of surgical resection and cesium-131 intraoperative brachytherapy versus surgical resection and stereotactic radiosurgery in the treatment of metastatic brain tumors, J Neurooncol, 2016 Mar; 127(1):0167-594X; 145-53",QALY,United States of America,Not Stated,Not Stated,surgical resection (S) and Cesium-131 (Cs-131) vs. Standard/Usual Care- surgical resection (S) and stereotactic radiosurgery (SRS) [S+SRS],Not Stated,84 Years,32 Years,"Female, Male",Full,Lifetime,Not Stated,Not Stated,-113400,United States,2014,-123974.25
15533,Cost-effectiveness of minimally invasive sacroiliac joint fusion,"BACKGROUND: Sacroiliac joint (SIJ) disorders are common in patients with chronic lower back pain. Minimally invasive surgical options have been shown to be effective for the treatment of chronic SIJ dysfunction. OBJECTIVE: To determine the cost-effectiveness of minimally invasive SIJ fusion. METHODS: Data from two prospective, multicenter, clinical trials were used to inform a Markov process cost-utility model to evaluate cumulative 5-year health quality and costs after minimally invasive SIJ fusion using triangular titanium implants or non-surgical treatment. The analysis was performed from a third-party perspective. The model specifically incorporated variation in resource utilization observed in the randomized trial. Multiple one-way and probabilistic sensitivity analyses were performed. RESULTS: SIJ fusion was associated with a gain of approximately 0.74 quality-adjusted life years (QALYs) at a cost of US$13,313 per QALY gained. In multiple one-way sensitivity analyses all scenarios resulted in an incremental cost-effectiveness ratio (ICER) <$26,000/QALY. Probabilistic analyses showed a high degree of certainty that the maximum ICER for SIJ fusion was less than commonly selected thresholds for acceptability (mean ICER =$13,687, 95% confidence interval $5,162-$28,085). SIJ fusion provided potential cost savings per QALY gained compared to non-surgical treatment after a treatment horizon of greater than 13 years. CONCLUSION: Compared to traditional non-surgical treatments, SIJ fusion is a cost-effective, and, in the long term, cost-saving strategy for the treatment of SIJ dysfunction due to degenerative sacroiliitis or SIJ disruption.",2016-01-20396,26719717,Clinicoecon Outcomes Res,Daniel J Cher,2016,8 /,1-14,No,26719717,"Daniel J Cher; Melissa A Frasco; Renee Jg Arnold; David W Polly; Cost-effectiveness of minimally invasive sacroiliac joint fusion, Clinicoecon Outcomes Res , 2016; 8():1178-6981; 1-14",QALY,United States of America,Not Stated,Not Stated,Sacroiliac joint (SIJ) fusion surgery vs. Standard/Usual Care- Non-surgical treatment,Not Stated,70 Years,40 Years,"Female, Male",Full,5 Years,3.00,3.00,13313,United States,2014,14554.4
15534,Cost-Effectiveness of Diagnostic Lobectomy Versus Observation for Thyroid Nodules >4 cm,"BACKGROUND: The management of thyroid nodules >4 cm with benign cytology after fine-needle aspiration biopsy (FNAB) is controversial. FNAB is associated with a high false-negative rate in this setting, and may result in a delayed diagnosis and management of thyroid cancer. However, the majority of these nodules are benign. Therefore, the objective of this study was to determine the cost-utility of observation versus surgical management for thyroid nodules >4 cm with benign cytology after FNAB. METHODS: A microsimulation model comparing routine thyroid lobectomy with observation for low-risk patients with >4 cm thyroid nodules with benign FNAB cytology was constructed. Costs, quality-adjusted life-years (QALYs), and life-years gained were calculated over a lifetime time horizon from a U.S. Medicare perspective. RESULTS: The proportion of patients undergoing thyroid lobectomy for benign final pathology was 40% in the observation strategy versus 66% in the surgical strategy (p < 0.001). Overall, the surgical strategy was associated with higher lifetime costs compared with the observation strategy (incremental difference: + US$12,992 [confidence interval (CI) 13,042-13,524]), but also more QALYs (+0.12 QALYs [CI 0.02-0.24]) and longer life expectancy (+1.67 years [CI 1.00-2.41]). Incremental lifetime costs were lower for patients <55 years compared with those >/=55 years (+11,181 vs. +14,811, p < 0.001). The probability of cost-effectiveness of the surgical strategy was 49% at a $100k/QALY threshold or 65% at a $100k/life-year gained threshold. CONCLUSIONS: Routine thyroid lobectomy is associated with improved outcomes at an acceptable cost compared with observation for thyroid nodules >4 cm with benign cytology after FNAB. Surgical resection may be a cost-effective strategy to rule out malignancy in these nodules.",2016-01-20413,26715288,Thyroid,Lawrence Lee,2016,26 / 2,271-9,No,26715288,"Lawrence Lee; Elliot J Mitmaker; John A Chabot; James A Lee; Jennifer H Kuo; Cost-Effectiveness of Diagnostic Lobectomy Versus Observation for Thyroid Nodules >4 cm, Thyroid, 2016 Feb; 26(2):1050-7256; 271-9",QALY,United States of America,Not Stated,Not Stated,Thyroid lobectomy vs. Standard/Usual Care- observation,low-risk patients with >4 cm thyroid nodules with benign fine-needle aspiration biopsy cytology,Not Stated,19 Years,"Female, Male",Full,Lifetime,3.00,3.00,108266.67,United States,2014,118362.25
