index,title,abstract,Master Ref#,PubMed ID,Journal,Primary Author,Publication Year,Volume / Issue,Pages,Priority Journal,PubMed ID:,Full Reference:,"Study Outcome ($/QALY, $/DALY, Both):",Study Country:,Disease Classification:,Intervention Type(s):,Intervention Phrase vs. Comparator Phrase:,Target Characteristics:,Max Target Age:,Min Target Age:,Target Genders:,Review:,Time Horizon:,Discounting Rate (Costs):,Discounting Rate (QALYs):,Incremental Cost-Effectiveness Ratio (Original currency and year):,Currency Country:,Currency Year:,Incremental Cost-Effectiveness Ratio (Converted to current $USD):
25701,Cost-effectiveness of current and optimal treatment for schizophrenia,"BACKGROUND: This paper is part of a project to identify the proportion of the burden of each mental disorder averted by current and optimal interventions, and the cost-effectiveness of both. AIMS: To use epidemiological data on schizophrenia to model the cost-effectiveness of current and optimal treatment. METHOD: Calculate the burden of schizophrenia in the years lived with disability (YLD) component of disability-adjusted life-years lost, the proportion averted by current interventions, the proportion that could be averted by optimal treatment and the cost-effectiveness of both. RESULTS: Current interventions avert some 13% of the burden, whereas 22% could be averted by optimal treatment. Current interventions cost about AUS 200,000 dollars per YLD averted, whereas optimal treatment at a similar cost could increase the number of YLDs averted by two-thirds. Even so, the majority of the burden of schizophrenia remains unavertable. CONCLUSIONS: Optimal treatment is affordable within the present budget and should be implemented.",2003-99-00548,14594918,Br J Psychiatry,Gavin Andrews,2003,183 /,427-35; discussion 436,No,14594918,"Gavin Andrews; Kristy Sanderson; Justine Corry; C Issakidis; H Lapsley; Cost-effectiveness of current and optimal treatment for schizophrenia, Br J Psychiatry, 2003-Nov; 183():0007-1250; 427-35; discussion 436",DALY,Australia,Not Stated,"Health Education or Behavior, Pharmaceutical, Other","Current treatment: all patients receiving antipsychotic medication (haloperidol or other typical antipsychotic, atypical antipsychotic, clozapine) and smaller proportion receiving psychosocial intervention vs. None",Not Stated,Not Stated,Not Stated,Not Stated,Full,,Not Stated,Not Stated,196070,Australia,1998,195856.63
25702,Cost-effectiveness of current and optimal treatment for schizophrenia,"BACKGROUND: This paper is part of a project to identify the proportion of the burden of each mental disorder averted by current and optimal interventions, and the cost-effectiveness of both. AIMS: To use epidemiological data on schizophrenia to model the cost-effectiveness of current and optimal treatment. METHOD: Calculate the burden of schizophrenia in the years lived with disability (YLD) component of disability-adjusted life-years lost, the proportion averted by current interventions, the proportion that could be averted by optimal treatment and the cost-effectiveness of both. RESULTS: Current interventions avert some 13% of the burden, whereas 22% could be averted by optimal treatment. Current interventions cost about AUS 200,000 dollars per YLD averted, whereas optimal treatment at a similar cost could increase the number of YLDs averted by two-thirds. Even so, the majority of the burden of schizophrenia remains unavertable. CONCLUSIONS: Optimal treatment is affordable within the present budget and should be implemented.",2003-99-00548,14594918,Br J Psychiatry,Gavin Andrews,2003,183 /,427-35; discussion 436,No,14594918,"Gavin Andrews; Kristy Sanderson; Justine Corry; C Issakidis; H Lapsley; Cost-effectiveness of current and optimal treatment for schizophrenia, Br J Psychiatry, 2003-Nov; 183():0007-1250; 427-35; discussion 436",DALY,Australia,Not Stated,"Health Education or Behavior, Pharmaceutical, Other","Optimal treatment with antipsychotic medication (haloperidol or other typical antipsychotic, atypical antipsychotic, clozapine) and psychosocial intervention based on severity groups vs. None",Not Stated,Not Stated,Not Stated,Not Stated,Full,,Not Stated,Not Stated,107482,Australia,1998,107365.04
25703,Is antenatal syphilis screening still cost effective in sub-Saharan Africa,"To estimate the cost effectiveness of on-site antenatal syphilis screening and treatment in Mwanza, Tanzania. To compare this intervention with other antenatal and child health interventions, specifically the prevention of mother to child transmission of HIV (PMTCT).The economic costs of adding the intervention to routine antenatal care were assessed. Cost effectiveness (CE) ratios of the intervention were obtained for low birth weight (LBW) live births and stillbirths averted and cost per DALY saved. Cost per DALY saved was also estimated for previous CE studies of syphilis screening. The CE of the intervention at different syphilis prevalence rates was modelled.The economic cost of the intervention is $1.44 per woman screened, $20 per woman treated, and $187 per adverse birth outcome averted. The cost per DALY saved is $110 with LBW as the only adverse outcome. When including stillbirth, this estimate improves 10-fold to $10.56 per DALY saved. The cost per DALY saved from all syphilis screening studies ranged from $3.97 to $18.73.Syphilis screening is shown to be at least as cost effective as PMTCT and more cost effective than many widely implemented interventions. There is urgent need for scaling up syphilis screening and treatment in high prevalence areas. The CE of screening interventions is highly dependent on disease prevalence. In combination, PMTCT and syphilis screening and treatment interventions may achieve economies of scope and thus improved efficiency.",2003-01-0436,14573832,Sex Transm Infect,F Terris-Prestholt,2003,79 / 5,375-81,No,14573832,"F Terris-Prestholt; D Watson-Jones; K Mugeye; L Kumaranayake; L Ndeki; H Weiss; J Changalucha; J Todd; F Lisekie; B Gumodoka; D Mabey; R Hayes; Andrew J. Teichtahl; Donna M. Urquhart; Yuanyuan Wang; Anita E. Wluka; Richard O''Sullivan; Graeme Jones; Flavia M. Cicuttini; Is antenatal syphilis screening still cost effective in sub-Saharan Africa, Sex Transm Infect, ; 79(5):1368-4973; 375-81",DALY,Tanzania,Not Stated,"Pharmaceutical, Screening","Screening for syphilis at first antenatal visit by rapid plasma reagin test (RPR), RPR positive women treated with one dose of benzathine pencillin (2.4 MU) vs. None","Pregnant, receiving antenatal care",Not Stated,Not Stated,Female,Full,,3.00,Not Stated,110,United States,2001,160.75
25704,Economic evaluation of zinc and copper use in treating acute diarrhea in children: A randomized controlled trial,"BACKGROUND: The therapeutic effects of zinc and copper in reducing diarrheal morbidity have important cost implications. This health services research study evaluated the cost of treating a child with acute diarrhea in the hospital, the impact of micronutrient supplementation on the mean predicted costs and its cost-effectiveness as compared to using only standard oral rehydration solution (ORS), from the patient""s and government""s (providers) perspective. METHODS: Children aged 6 months to 59 months with acute diarrhea were randomly assigned to receive either the intervention or control. The intervention was a daily dose of 40 mg of zinc sulfate and 5 mg of copper sulfate powder dissolved in a liter of standard ORS (n = 102). The control was 50 mg of standard ORS powder dissolved in a liter of standard ORS (n = 98). The cost measures were the total mean cost of treating acute diarrhea, which included the direct medical, the direct non-medical and the indirect costs. The effectiveness measures were the probability of diarrhea lasting leq; 4 days, the disability adjusted life years (DALYs) and mortality. RESULTS: The mean total cost of treating a child with acute diarrhea was US $14 of which the government incurred an expenditure of 66%. The factors that increased the total were the number of stools before admission (p = 0.01), fever (p = 0.01), increasing grade of dehydration (p = 0.00), use of antibiotics (p = 0.00), use of intra-venous fluids (p = 0.00), hours taken to rehydrate a child (p = 0.00), the amount of oral rehydration fluid used (p = 0.00), presence of any complications (p = 0.00) and the hospital stay (p = 0.00). The supplemented group had a 8% lower cost of treating acute diarrhea, their cost per unit health (diarrhea lasting leq; 4 days) was 24% less and the incremental cost-effectiveness ratio indicated cost savings (in Rupees) with the intervention [-452; 95%CI (-11306, 3410)]. However these differences failed to reach conventional levels of significance. CONCLUSION: An emphasis on the costs and economic benefits of an alternative therapy is an important aspect of health services research. The cost savings and the attractive cost-effectiveness indicates the need to further assess the role of micronutrients such as zinc and copper in the treatment of acute diarrhea in a larger and more varied population.",2003-99-00584,14498987,Cost Eff Resour Alloc,Archana Patel,2003,1 / 1,7,Yes,14498987,"Archana Patel; Leena Dhande; Manwar Rawat; Economic evaluation of zinc and copper use in treating acute diarrhea in children: A randomized controlled trial, Cost Eff Resour Alloc, 2003-Aug-29; 1(1):1478-7547; 7",DALY,India,Not Stated,Other,Zinc and copper supplementation added to standard oral rehydration solution vs. Standard/Usual Care- oral rehydration solution (ORS) (1 liter),Not Stated,5 Years,Not Stated,"Female, Male",Full,,12.00,5.00,-400,India,1996,-19.27
25705,"Cost-effectiveness of routine immunization to control Japanese encephalitis in Shanghai, China","OBJECTIVE: To assess the cost-effectiveness of inactivated and live attenuated Japanese encephalitis (JE) vaccines given to infants and children in Shanghai. METHODS: A decision-analytical model was constructed in order to compare costs and outcomes for three hypothetical cohorts of 100,000 children followed from birth in 1997 to the age of 30 years who received either no JE vaccine, inactivated JE vaccine (P3), or live attenuated JE vaccine (SA 14-14-2). Cumulative incidences of JE from birth to 30 years of age in the pre-immunization era, i.e. before 1968, were used to estimate expected rates of JE in the absence of vaccination. The economic consequences were measured as cost per case, per death, and per disability-adjusted life year (DALY) averted for the two JE immunization programmes. FINDINGS: In comparison with no JE immunization, a programme using the P3 vaccine would prevent 420 JE cases and 105 JE deaths and would save 6456 DALYs per 100,000 persons; the use of the SA 14-14-2 vaccine would prevent 427 cases and 107 deaths and would save 6556 DALYs per 100,000 persons. Both kinds of immunization were cost saving but the SA 14-14-2 vaccine strategy resulted in a saving that was 47% greater (512,456 US dollars) than that obtained with the P3 vaccine strategy (348,246 US dollars). CONCLUSION: Both JE immunization strategies resulted in cost savings in comparison with no JE immunization. This provides a strong economic rationale for vaccinating against JE in Shanghai and suggests that vaccination against JE might be economically justifiable in other parts of China and in certain other developing countries of Asia where the disease is endemic.",2003-99-00650,12856051,Bull World Health Organ,Ding Ding,2003,81 / 5,334-42,No,12856051,"Ding Ding; Paul E Kilgore; John D Clemens; Liu Wei; Xu Zhi-Yi; Cost-effectiveness of routine immunization to control Japanese encephalitis in Shanghai, China, Bull World Health Organ, 2003; 81(5):0042-9686; 334-42",DALY,China,Not Stated,Immunization,Inactivated P3 vaccine for Japanese encephalitis vs. None,Not Stated,5 Years,Not Stated,"Female, Male",Full,,3.00,3.00,-53.94,United States,1997,-86.98
25706,"Cost-effectiveness of routine immunization to control Japanese encephalitis in Shanghai, China","OBJECTIVE: To assess the cost-effectiveness of inactivated and live attenuated Japanese encephalitis (JE) vaccines given to infants and children in Shanghai. METHODS: A decision-analytical model was constructed in order to compare costs and outcomes for three hypothetical cohorts of 100,000 children followed from birth in 1997 to the age of 30 years who received either no JE vaccine, inactivated JE vaccine (P3), or live attenuated JE vaccine (SA 14-14-2). Cumulative incidences of JE from birth to 30 years of age in the pre-immunization era, i.e. before 1968, were used to estimate expected rates of JE in the absence of vaccination. The economic consequences were measured as cost per case, per death, and per disability-adjusted life year (DALY) averted for the two JE immunization programmes. FINDINGS: In comparison with no JE immunization, a programme using the P3 vaccine would prevent 420 JE cases and 105 JE deaths and would save 6456 DALYs per 100,000 persons; the use of the SA 14-14-2 vaccine would prevent 427 cases and 107 deaths and would save 6556 DALYs per 100,000 persons. Both kinds of immunization were cost saving but the SA 14-14-2 vaccine strategy resulted in a saving that was 47% greater (512,456 US dollars) than that obtained with the P3 vaccine strategy (348,246 US dollars). CONCLUSION: Both JE immunization strategies resulted in cost savings in comparison with no JE immunization. This provides a strong economic rationale for vaccinating against JE in Shanghai and suggests that vaccination against JE might be economically justifiable in other parts of China and in certain other developing countries of Asia where the disease is endemic.",2003-99-00650,12856051,Bull World Health Organ,Ding Ding,2003,81 / 5,334-42,No,12856051,"Ding Ding; Paul E Kilgore; John D Clemens; Liu Wei; Xu Zhi-Yi; Cost-effectiveness of routine immunization to control Japanese encephalitis in Shanghai, China, Bull World Health Organ, 2003; 81(5):0042-9686; 334-42",DALY,China,Not Stated,Immunization,Live attenuated SA 14-14-2 vaccine for Japanese encephalitis vs. None,Not Stated,5 Years,Not Stated,"Female, Male",Full,,3.00,3.00,-78.17,United States,1997,-126.04
25707,The cost-effectiveness of policies for the safe and appropriate use of injection in healthcare settings,"OBJECTIVE: Poor injection practices transmit potentially life-threatening pathogens. We modelled the cost-effectiveness of policies for the safe and appropriate use of injections in ten epidemiological subregions of the world in terms of cost per disability-adjusted life year (DALY) averted. METHODS: The incidence of injection-associated hepatitis B virus (HBV), hepatitis C virus (HCV), and human immunodeficiency virus (HIV) infections was modelled for a year 2000 cohort over a 30-year time horizon. The consequences of a ""do nothing"" scenario were compared with a set of hypothetical scenarios that incorporated the health gains of effective interventions. Resources needed to implement effective interventions were costed for each subregion and expressed in international dollars (I dollars). FINDINGS: Worldwide, the reuse of injection equipment in the year 2000 accounted for 32%, 40%, and 5% of new HBV, HCV and HIV infections, respectively, leading to a burden of 9.18 million DALYs between 2000 and 2030. Interventions implemented in the year 2000 for the safe (provision of single-use syringes, assumed effectiveness 95%) and appropriate (patients-providers interactional group discussions, assumed effectiveness 30%) use of injections could reduce the burden of injection-associated infections by as much as 96.5% (8.86 million DALYs) for an average yearly cost of 905 million I dollars (average cost per DALY averted, 102; range by region, 14-2293). Attributable fractions and the number of syringes and needles required represented the key sources of uncertainty. CONCLUSION: In all subregions studied, each DALY averted through policies for the safe and appropriate use of injections costs considerably less than one year of average per capita income, which makes such policies a sound investment for health care.",2003-99-00695,12764494,Bull World Health Organ,Gerald Dziekan,2003,81 / 5,277-85,No,12764494,"Gerald Dziekan; Dan Chisholm; Benjamin Johns; Juan Rovira; Yvan J F Hutin; The cost-effectiveness of policies for the safe and appropriate use of injection in healthcare settings, Bull World Health Organ, 2003; 81(5):0042-9686; 277-85",DALY,"Algeria, Angola, Benin, Burkina Faso, Cabo Verde, Cameroon, Chad, Comoros, Equatorial Guinea, Gabon, Gambia, Ghana, Guinea, Guinea-Bissau, Liberia, Madagascar, Mali, Mauritania, Mauritius, Niger, Nigeria, Sao Tome and Principe, Senegal, Seychelles, Sierra Leone, Togo",Not Stated,"Health Education or Behavior, Other",Reduction of injection use via patients-providers interactional group discussions vs. None,Not Stated,Not Stated,Not Stated,"Female, Male",Full,,3.00,3.00,16,United States,2000,24.05
25708,The cost-effectiveness of policies for the safe and appropriate use of injection in healthcare settings,"OBJECTIVE: Poor injection practices transmit potentially life-threatening pathogens. We modelled the cost-effectiveness of policies for the safe and appropriate use of injections in ten epidemiological subregions of the world in terms of cost per disability-adjusted life year (DALY) averted. METHODS: The incidence of injection-associated hepatitis B virus (HBV), hepatitis C virus (HCV), and human immunodeficiency virus (HIV) infections was modelled for a year 2000 cohort over a 30-year time horizon. The consequences of a ""do nothing"" scenario were compared with a set of hypothetical scenarios that incorporated the health gains of effective interventions. Resources needed to implement effective interventions were costed for each subregion and expressed in international dollars (I dollars). FINDINGS: Worldwide, the reuse of injection equipment in the year 2000 accounted for 32%, 40%, and 5% of new HBV, HCV and HIV infections, respectively, leading to a burden of 9.18 million DALYs between 2000 and 2030. Interventions implemented in the year 2000 for the safe (provision of single-use syringes, assumed effectiveness 95%) and appropriate (patients-providers interactional group discussions, assumed effectiveness 30%) use of injections could reduce the burden of injection-associated infections by as much as 96.5% (8.86 million DALYs) for an average yearly cost of 905 million I dollars (average cost per DALY averted, 102; range by region, 14-2293). Attributable fractions and the number of syringes and needles required represented the key sources of uncertainty. CONCLUSION: In all subregions studied, each DALY averted through policies for the safe and appropriate use of injections costs considerably less than one year of average per capita income, which makes such policies a sound investment for health care.",2003-99-00695,12764494,Bull World Health Organ,Gerald Dziekan,2003,81 / 5,277-85,No,12764494,"Gerald Dziekan; Dan Chisholm; Benjamin Johns; Juan Rovira; Yvan J F Hutin; The cost-effectiveness of policies for the safe and appropriate use of injection in healthcare settings, Bull World Health Organ, 2003; 81(5):0042-9686; 277-85",DALY,"Algeria, Angola, Benin, Burkina Faso, Cabo Verde, Cameroon, Chad, Comoros, Equatorial Guinea, Gabon, Gambia, Ghana, Guinea, Guinea-Bissau, Liberia, Madagascar, Mali, Mauritania, Mauritius, Niger, Nigeria, Sao Tome and Principe, Senegal, Seychelles, Sierra Leone, Togo",Not Stated,"Care Delivery, Other",Reduction of unsafe injection use via use of single-use syringes vs. Reduction of injection use via patients-providers interactional group discussions,Not Stated,Not Stated,Not Stated,"Female, Male",Full,,3.00,3.00,50,United States,2000,75.15
25709,The cost-effectiveness of policies for the safe and appropriate use of injection in healthcare settings,"OBJECTIVE: Poor injection practices transmit potentially life-threatening pathogens. We modelled the cost-effectiveness of policies for the safe and appropriate use of injections in ten epidemiological subregions of the world in terms of cost per disability-adjusted life year (DALY) averted. METHODS: The incidence of injection-associated hepatitis B virus (HBV), hepatitis C virus (HCV), and human immunodeficiency virus (HIV) infections was modelled for a year 2000 cohort over a 30-year time horizon. The consequences of a ""do nothing"" scenario were compared with a set of hypothetical scenarios that incorporated the health gains of effective interventions. Resources needed to implement effective interventions were costed for each subregion and expressed in international dollars (I dollars). FINDINGS: Worldwide, the reuse of injection equipment in the year 2000 accounted for 32%, 40%, and 5% of new HBV, HCV and HIV infections, respectively, leading to a burden of 9.18 million DALYs between 2000 and 2030. Interventions implemented in the year 2000 for the safe (provision of single-use syringes, assumed effectiveness 95%) and appropriate (patients-providers interactional group discussions, assumed effectiveness 30%) use of injections could reduce the burden of injection-associated infections by as much as 96.5% (8.86 million DALYs) for an average yearly cost of 905 million I dollars (average cost per DALY averted, 102; range by region, 14-2293). Attributable fractions and the number of syringes and needles required represented the key sources of uncertainty. CONCLUSION: In all subregions studied, each DALY averted through policies for the safe and appropriate use of injections costs considerably less than one year of average per capita income, which makes such policies a sound investment for health care.",2003-99-00695,12764494,Bull World Health Organ,Gerald Dziekan,2003,81 / 5,277-85,No,12764494,"Gerald Dziekan; Dan Chisholm; Benjamin Johns; Juan Rovira; Yvan J F Hutin; The cost-effectiveness of policies for the safe and appropriate use of injection in healthcare settings, Bull World Health Organ, 2003; 81(5):0042-9686; 277-85",DALY,"Algeria, Angola, Benin, Burkina Faso, Cabo Verde, Cameroon, Chad, Comoros, Equatorial Guinea, Gabon, Gambia, Ghana, Guinea, Guinea-Bissau, Liberia, Madagascar, Mali, Mauritania, Mauritius, Niger, Nigeria, Sao Tome and Principe, Senegal, Seychelles, Sierra Leone, Togo",Not Stated,"Care Delivery, Health Education or Behavior, Other",Reduction of unsafe injection use via use of single-use syringes and reduction of injection use via patients-providers interactional group discussions vs. Reduction of unsafe injection use via provision of single-use syringes,Not Stated,Not Stated,Not Stated,"Female, Male",Full,,3.00,3.00,234,United States,2000,351.69
25710,The cost-effectiveness of policies for the safe and appropriate use of injection in healthcare settings,"OBJECTIVE: Poor injection practices transmit potentially life-threatening pathogens. We modelled the cost-effectiveness of policies for the safe and appropriate use of injections in ten epidemiological subregions of the world in terms of cost per disability-adjusted life year (DALY) averted. METHODS: The incidence of injection-associated hepatitis B virus (HBV), hepatitis C virus (HCV), and human immunodeficiency virus (HIV) infections was modelled for a year 2000 cohort over a 30-year time horizon. The consequences of a ""do nothing"" scenario were compared with a set of hypothetical scenarios that incorporated the health gains of effective interventions. Resources needed to implement effective interventions were costed for each subregion and expressed in international dollars (I dollars). FINDINGS: Worldwide, the reuse of injection equipment in the year 2000 accounted for 32%, 40%, and 5% of new HBV, HCV and HIV infections, respectively, leading to a burden of 9.18 million DALYs between 2000 and 2030. Interventions implemented in the year 2000 for the safe (provision of single-use syringes, assumed effectiveness 95%) and appropriate (patients-providers interactional group discussions, assumed effectiveness 30%) use of injections could reduce the burden of injection-associated infections by as much as 96.5% (8.86 million DALYs) for an average yearly cost of 905 million I dollars (average cost per DALY averted, 102; range by region, 14-2293). Attributable fractions and the number of syringes and needles required represented the key sources of uncertainty. CONCLUSION: In all subregions studied, each DALY averted through policies for the safe and appropriate use of injections costs considerably less than one year of average per capita income, which makes such policies a sound investment for health care.",2003-99-00695,12764494,Bull World Health Organ,Gerald Dziekan,2003,81 / 5,277-85,No,12764494,"Gerald Dziekan; Dan Chisholm; Benjamin Johns; Juan Rovira; Yvan J F Hutin; The cost-effectiveness of policies for the safe and appropriate use of injection in healthcare settings, Bull World Health Organ, 2003; 81(5):0042-9686; 277-85",DALY,"Botswana, Burundi, Central African Republic, Congo Democratic Republic, Congo, Côte d'Ivoire, Eritrea, Ethiopia, Kenya, Lesotho, Malawi, Mozambique, Namibia, Rwanda, South Africa, Swaziland, Tanzania, Uganda, Zambia, Zimbabwe",Not Stated,"Health Education or Behavior, Other",Reduction of injection use via patients-providers interactional group discussions vs. None,Not Stated,Not Stated,Not Stated,"Female, Male",Full,,3.00,3.00,7,United States,2000,10.52
