3078,Cost-effectiveness analysis of hypertension guidelines in South Africa: absolute risk versus blood pressure level,"BACKGROUND: Hypertension is responsible for more deaths worldwide than any other cardiovascular risk factor. Guidelines based on blood pressure level for initiation of treatment of hypertension may be too costly compared with an approach based on absolute cardiovascular disease (CVD) risk, especially in developing countries. METHODS AND RESULTS: Using a Markov CVD model, we compared 6 strategies for initiation of drug treatment--2 different blood pressure levels (160/95 and 140/90 mm Hg) and 4 different levels of absolute CVD risk over 10 years (40%, 30%, 20%, and 15%)--with one of no treatment. We modeled a hypothetical cohort of all adults without CVD in South Africa, a multiethnic developing country, over 10 years. The incremental cost-effectiveness ratios for treating those with 10-year absolute risk for CVD >40%, 30%, 20%, and 15% were 700 dollars, 1600 dollars, 4900 dollars, and 11,000 dollars per quality-adjusted life-year gained, respectively. Strategies based on a target blood pressure level were both more expensive and less effective than treatment decisions based on the strategy that used absolute CVD risk of >15%. Sensitivity analysis of cost of treatments, prevalence estimates of risk factors, and benefits expected from treatment did not change the ranking of the strategies. CONCLUSIONS: In South Africa, current guidelines based on blood pressure levels are both more expensive and less effective than guidelines based on absolute risk of cardiovascular disease. The use of quantitative risk-based guidelines for treatment of hypertension could free up major resources for other pressing needs, especially in developing countries.",2005-01-01581,16330698,Circulation,Thomas A Gaziano,2005,112 / 23,3569-76,No,16330698,"Thomas A Gaziano; Krisela Steyn; David J Cohen; Milton C Weinstein; Lionel H Opie; Cost-effectiveness analysis of hypertension guidelines in South Africa: absolute risk versus blood pressure level, Circulation, 2005-Dec-06; 112(23):0009-7322; 3569-76",QALY,Not Stated,Not Stated,Not Stated,1995 South African hypertension guidelines vs. Therapy when risk of cardiovascular disease is >15%,Not Stated,Not Stated,Not Stated,"Female, Male",Full,Lifetime,3.00,3.00,-2791.67,United States,2003,-3926.71
3079,Cost-effectiveness analysis of hypertension guidelines in South Africa: absolute risk versus blood pressure level,"BACKGROUND: Hypertension is responsible for more deaths worldwide than any other cardiovascular risk factor. Guidelines based on blood pressure level for initiation of treatment of hypertension may be too costly compared with an approach based on absolute cardiovascular disease (CVD) risk, especially in developing countries. METHODS AND RESULTS: Using a Markov CVD model, we compared 6 strategies for initiation of drug treatment--2 different blood pressure levels (160/95 and 140/90 mm Hg) and 4 different levels of absolute CVD risk over 10 years (40%, 30%, 20%, and 15%)--with one of no treatment. We modeled a hypothetical cohort of all adults without CVD in South Africa, a multiethnic developing country, over 10 years. The incremental cost-effectiveness ratios for treating those with 10-year absolute risk for CVD >40%, 30%, 20%, and 15% were 700 dollars, 1600 dollars, 4900 dollars, and 11,000 dollars per quality-adjusted life-year gained, respectively. Strategies based on a target blood pressure level were both more expensive and less effective than treatment decisions based on the strategy that used absolute CVD risk of >15%. Sensitivity analysis of cost of treatments, prevalence estimates of risk factors, and benefits expected from treatment did not change the ranking of the strategies. CONCLUSIONS: In South Africa, current guidelines based on blood pressure levels are both more expensive and less effective than guidelines based on absolute risk of cardiovascular disease. The use of quantitative risk-based guidelines for treatment of hypertension could free up major resources for other pressing needs, especially in developing countries.",2005-01-01581,16330698,Circulation,Thomas A Gaziano,2005,112 / 23,3569-76,No,16330698,"Thomas A Gaziano; Krisela Steyn; David J Cohen; Milton C Weinstein; Lionel H Opie; Cost-effectiveness analysis of hypertension guidelines in South Africa: absolute risk versus blood pressure level, Circulation, 2005-Dec-06; 112(23):0009-7322; 3569-76",QALY,Not Stated,Not Stated,Not Stated,1995 South African hypertension guidelines vs. Therapy when risk of cardiovascular disease is >15%,Not Stated,Not Stated,Not Stated,"Female, Male",Full,Lifetime,3.00,3.00,-63400,United States,2003,-89177.27
3080,Economic evaluation of a randomized trial comparing Helicobacter pylori test-and-treat and prompt endoscopy strategies for managing dyspepsia in a primary-care setting,"BACKGROUND: In western European countries, most dyspeptic patients are initially managed by their general practitioners (GPs), who use a range of strategies to manage dyspepsia. We performed an economic analysis of a Helicobacter pylori test-and-treat strategy versus a prompt endoscopy approach in a primary care setting. METHODS: Data were used from the Strategy: Endoscopy versus Serology (SENSE) study, performed in The Netherlands from 1998 to 2001. Patients were randomized to a prompt endoscopy (n = 105) or test-and-treat (n = 118) group. Follow-up lasted 1 year. Adverse events were not recorded in the SENSE study. Health care costs were based on the total amount of dyspepsia-related drugs used, the number of dyspepsia-related GP visits, the number of diagnostic tests, and the number of dyspepsia-related referrals to specialists. The use of medical resources was calculated as standardized costs for 1999, recorded as euros. (On December 31, 1999, 1.00 Euro = 1.00 US dollar.) Quality of life was measured at inclusion and 1 year later, using the RAND-36 questionnaire. To calculate quality-adjusted life-years (QALYs), we transformed the individual scores of the RAND-36 into 1 overall score, the Health Utilities Index Mark 2, which introduced a limitation to the study. An incremental cost-effectiveness ratio (ICER) was calculated. The 95% confidence limits were calculated using a parametric bootstrap method with angular transformation. All cost data were analyzed from a third-party payer perspective. RESULTS: The total costs per patient were 511 Euros, with 0.037 QALY gained per patient, in the test-and-treat group, and 748 Euros, with 0.032 QALY gained per patient, in the endoscopy group (between groups, P < 0.001 and P = NS, respectively). The point estimate of the ICER indicated that the test-and-treat strategy yielded cost savings and QALYs gained. Parametric bootstrap confidence limits indicated cost savings per QALY gained in 75.7% of the bootstrap simulations. CONCLUSION: This analysis of data from the SENSE1026 study suggests that the H pylori test-and-treat strategy was more cost-effective than prompt endoscopy in the initial management of dyspepsia in general practice, from the perspective of a third-party payer.",2005-01-01582,16330302,Clin Ther,Rogier M Klok,2005,27 / 10,1647-57,Yes,16330302,"Rogier M Klok; Nicolaas L A Arents; Robin de Vries; Jacob C Thijs; Jacobus R B J Brouwers; Jan H Kleibeuker; Maarten J Postma; Nicolaas L A Arents; Robin de Vries; Jacob C Thijs; Jacobus R B J Brouwers; Jan H Kleibeuker; Maarten J Postma; Economic evaluation of a randomized trial comparing Helicobacter pylori test-and-treat and prompt endoscopy strategies for managing dyspepsia in a primary-care setting, Clin Ther, 2005-Oct; 27(10):1879-114X; 1647-57",QALY,Not Stated,Not Stated,Not Stated,Helicobacter pylori test followed by treatment vs. Endoscopy,Not Stated,Not Stated,Not Stated,"Female, Male",Full,1 Year,Not Stated,Not Stated,-47412,Euro,1999,-78462.15
3081,Surgery versus medical follow-up in patients with asymptomatic primary hyperparathyroidism: a decision analysis,"OBJECTIVES: To examine the cost-effectiveness of strategies for management of primary asymptomatic hyperparathyroidism: surgical strategies and medical follow-up versus surgery. DESIGN: We used a Markov state-transition decision-analytic model for an hypothetical cohort of 55-year-old women to compare with a lifetime horizon costs and effectiveness of bilateral neck exploration (BNE), unilateral neck exploration (UNE), video-assisted parathyroidectomy (VAP) and lifelong medical follow-up shifting for either BNE or UNE in case of disease progression. METHODS: Data on localization tests, complications and treatment efficacies were derived from a systematic review of the literature. Outcomes were expressed as quality-adjusted life years (QALY). Costs (2002 Euro) discounted at 3% yearly were estimated from the health care system perspective. RESULTS: In the base-case analysis, VAP strategy (VAPS) was the most effective and BNE strategy (BNES) was the least costly. UNE strategy (UNES) had an incremental cost-effectiveness ratio of 2688 Euro/QALY versus BNES and VAPS of 17,250 Euro/QALY in comparison with UNES. Surgical management was more effective than medical follow-up with acceptable incremental cost-effectiveness ratios. VAPS became less effective than UNES over 71 years. Differences between UNES and VAPS were sensitive to success and complication rates, quality-of-life weights and procedural costs. Medical follow-up strategies became the most effective if quality-of-life weight for this condition was higher than 0.99. CONCLUSIONS: Surgery is more effective than medical follow-up at a reasonable cost and can be preferred except in patients choosing medical follow-up. Minimally invasive surgery is cost-effective compared to the traditional surgical approach.",2005-01-01583,16322399,Eur J Endocrinol,Karine Sejean,2005,153 / 6,915-27,No,16322399,"Karine Sejean; Sophie Calmus; Isabelle Durand-Zaleski; Philippe Bonnichon; Pierre Thomopoulos; Catherine Cormier; Paul Legmann; Bruno Richard; Xavier Y Bertagna; Gwenaelle M Vidal-Trecan; Sophie Calmus; Isabelle Durand-Zaleski; Philippe Bonnichon; Pierre Thomopoulos; Catherine Cormier; Paul Legmann; Bruno Richard; Xavier Y Bertagna; Gwenaelle M Vidal-Trecan; Surgery versus medical follow-up in patients with asymptomatic primary hyperparathyroidism: a decision analysis, Eur J Endocrinol, 2005-Dec; 153(6):0804-4643; 915-27",QALY,Not Stated,Not Stated,Not Stated,Unilateral neck exploration vs. Bilateral neck exploration,Not Stated,55 Years,55 Years,Female,Full,Lifetime,3.00,3.00,2688,Euro,2002,3655.86
3082,Surgery versus medical follow-up in patients with asymptomatic primary hyperparathyroidism: a decision analysis,"OBJECTIVES: To examine the cost-effectiveness of strategies for management of primary asymptomatic hyperparathyroidism: surgical strategies and medical follow-up versus surgery. DESIGN: We used a Markov state-transition decision-analytic model for an hypothetical cohort of 55-year-old women to compare with a lifetime horizon costs and effectiveness of bilateral neck exploration (BNE), unilateral neck exploration (UNE), video-assisted parathyroidectomy (VAP) and lifelong medical follow-up shifting for either BNE or UNE in case of disease progression. METHODS: Data on localization tests, complications and treatment efficacies were derived from a systematic review of the literature. Outcomes were expressed as quality-adjusted life years (QALY). Costs (2002 Euro) discounted at 3% yearly were estimated from the health care system perspective. RESULTS: In the base-case analysis, VAP strategy (VAPS) was the most effective and BNE strategy (BNES) was the least costly. UNE strategy (UNES) had an incremental cost-effectiveness ratio of 2688 Euro/QALY versus BNES and VAPS of 17,250 Euro/QALY in comparison with UNES. Surgical management was more effective than medical follow-up with acceptable incremental cost-effectiveness ratios. VAPS became less effective than UNES over 71 years. Differences between UNES and VAPS were sensitive to success and complication rates, quality-of-life weights and procedural costs. Medical follow-up strategies became the most effective if quality-of-life weight for this condition was higher than 0.99. CONCLUSIONS: Surgery is more effective than medical follow-up at a reasonable cost and can be preferred except in patients choosing medical follow-up. Minimally invasive surgery is cost-effective compared to the traditional surgical approach.",2005-01-01583,16322399,Eur J Endocrinol,Karine Sejean,2005,153 / 6,915-27,No,16322399,"Karine Sejean; Sophie Calmus; Isabelle Durand-Zaleski; Philippe Bonnichon; Pierre Thomopoulos; Catherine Cormier; Paul Legmann; Bruno Richard; Xavier Y Bertagna; Gwenaelle M Vidal-Trecan; Sophie Calmus; Isabelle Durand-Zaleski; Philippe Bonnichon; Pierre Thomopoulos; Catherine Cormier; Paul Legmann; Bruno Richard; Xavier Y Bertagna; Gwenaelle M Vidal-Trecan; Surgery versus medical follow-up in patients with asymptomatic primary hyperparathyroidism: a decision analysis, Eur J Endocrinol, 2005-Dec; 153(6):0804-4643; 915-27",QALY,Not Stated,Not Stated,Not Stated,Video-assisted parathyroidectomy vs. Unilateral neck exploration,Not Stated,55 Years,55 Years,Female,Full,Lifetime,3.00,3.00,17250,Euro,2002,23461.14
3083,Surgery versus medical follow-up in patients with asymptomatic primary hyperparathyroidism: a decision analysis,"OBJECTIVES: To examine the cost-effectiveness of strategies for management of primary asymptomatic hyperparathyroidism: surgical strategies and medical follow-up versus surgery. DESIGN: We used a Markov state-transition decision-analytic model for an hypothetical cohort of 55-year-old women to compare with a lifetime horizon costs and effectiveness of bilateral neck exploration (BNE), unilateral neck exploration (UNE), video-assisted parathyroidectomy (VAP) and lifelong medical follow-up shifting for either BNE or UNE in case of disease progression. METHODS: Data on localization tests, complications and treatment efficacies were derived from a systematic review of the literature. Outcomes were expressed as quality-adjusted life years (QALY). Costs (2002 Euro) discounted at 3% yearly were estimated from the health care system perspective. RESULTS: In the base-case analysis, VAP strategy (VAPS) was the most effective and BNE strategy (BNES) was the least costly. UNE strategy (UNES) had an incremental cost-effectiveness ratio of 2688 Euro/QALY versus BNES and VAPS of 17,250 Euro/QALY in comparison with UNES. Surgical management was more effective than medical follow-up with acceptable incremental cost-effectiveness ratios. VAPS became less effective than UNES over 71 years. Differences between UNES and VAPS were sensitive to success and complication rates, quality-of-life weights and procedural costs. Medical follow-up strategies became the most effective if quality-of-life weight for this condition was higher than 0.99. CONCLUSIONS: Surgery is more effective than medical follow-up at a reasonable cost and can be preferred except in patients choosing medical follow-up. Minimally invasive surgery is cost-effective compared to the traditional surgical approach.",2005-01-01583,16322399,Eur J Endocrinol,Karine Sejean,2005,153 / 6,915-27,No,16322399,"Karine Sejean; Sophie Calmus; Isabelle Durand-Zaleski; Philippe Bonnichon; Pierre Thomopoulos; Catherine Cormier; Paul Legmann; Bruno Richard; Xavier Y Bertagna; Gwenaelle M Vidal-Trecan; Sophie Calmus; Isabelle Durand-Zaleski; Philippe Bonnichon; Pierre Thomopoulos; Catherine Cormier; Paul Legmann; Bruno Richard; Xavier Y Bertagna; Gwenaelle M Vidal-Trecan; Surgery versus medical follow-up in patients with asymptomatic primary hyperparathyroidism: a decision analysis, Eur J Endocrinol, 2005-Dec; 153(6):0804-4643; 915-27",QALY,Not Stated,Not Stated,Not Stated,Bilateral neck exploration vs. Medical follow up with bilateral neck exploration,Not Stated,55 Years,55 Years,Female,Full,Lifetime,3.00,3.00,762,Euro,2002,1036.37
3084,Closing the youth access gap: the projected health benefits and cost savings of a national policy to raise the legal smoking age to 21 in the United States,"Current youth access laws, even if strictly enforced, do not prevent teenagers from obtaining cigarettes through social sources. To reduce the number of legal buyers a typical teenager routinely encounters, and to lessen ambiguity for vendors determining if a teen is of legal purchasing age, legislation raising the minimum legal purchase age (MLPA) for cigarettes to 21 has been discussed in several states. To estimate how a national law raising the smoking age to 21 would impact smoking prevalence, net costs (in terms of compliance enforcement, ID checking, and medical care) and health benefits (in terms of life years and QALYs) to the population over time, a dynamic computer simulation model was developed using publicly available secondary data. The model simulations were carried out for several scenarios assuming varying impacts of the policy change on smoking initiation probability over a 50-year period. One scenario assumes that smoking initiation probabilities for individuals under 21 shift by 3 years so a 18-year old in the simulation, for example, is as likely to initiate smoking as an 15-year old in the status quo. Under this assumption, raising the smoking age would reduce smoking prevalence for adults (age 18+) from the status quo level of 22.1-15.4% after 50 years. Prevalence would drop from 20 to 6.6% for 14-17-year olds, from 26.9 to 12.2% for 18-20-year olds, and from 21.8 to 15.5% for the 21+ group. The policy would produce a net cumulative savings to society of 212 billion US dollars (driven by reduced medical costs), and the accumulation of nearly 13 million additional QALYs over the period.",2005-01-01600,16298230,Health Policy,Sajjad Ahmad,2005,75 / 1,74-84,No,16298230,"Sajjad Ahmad; Closing the youth access gap: the projected health benefits and cost savings of a national policy to raise the legal smoking age to 21 in the United States, Health Policy, 2005-Dec; 75(1):0168-8510; 74-84",QALY,Not Stated,Not Stated,Not Stated,Legal smoking age of 21 vs. Status quo,Not Stated,20 Years,Not Stated,"Female, Male",Full,50 Years,3.00,3.00,-16331.25,United States,2003,-22971.23
3085,Closing the youth access gap: the projected health benefits and cost savings of a national policy to raise the legal smoking age to 21 in the United States,"Current youth access laws, even if strictly enforced, do not prevent teenagers from obtaining cigarettes through social sources. To reduce the number of legal buyers a typical teenager routinely encounters, and to lessen ambiguity for vendors determining if a teen is of legal purchasing age, legislation raising the minimum legal purchase age (MLPA) for cigarettes to 21 has been discussed in several states. To estimate how a national law raising the smoking age to 21 would impact smoking prevalence, net costs (in terms of compliance enforcement, ID checking, and medical care) and health benefits (in terms of life years and QALYs) to the population over time, a dynamic computer simulation model was developed using publicly available secondary data. The model simulations were carried out for several scenarios assuming varying impacts of the policy change on smoking initiation probability over a 50-year period. One scenario assumes that smoking initiation probabilities for individuals under 21 shift by 3 years so a 18-year old in the simulation, for example, is as likely to initiate smoking as an 15-year old in the status quo. Under this assumption, raising the smoking age would reduce smoking prevalence for adults (age 18+) from the status quo level of 22.1-15.4% after 50 years. Prevalence would drop from 20 to 6.6% for 14-17-year olds, from 26.9 to 12.2% for 18-20-year olds, and from 21.8 to 15.5% for the 21+ group. The policy would produce a net cumulative savings to society of 212 billion US dollars (driven by reduced medical costs), and the accumulation of nearly 13 million additional QALYs over the period.",2005-01-01600,16298230,Health Policy,Sajjad Ahmad,2005,75 / 1,74-84,No,16298230,"Sajjad Ahmad; Closing the youth access gap: the projected health benefits and cost savings of a national policy to raise the legal smoking age to 21 in the United States, Health Policy, 2005-Dec; 75(1):0168-8510; 74-84",QALY,Not Stated,Not Stated,Not Stated,Legal smoking age of 21 vs. Status quo,Not Stated,20 Years,Not Stated,"Female, Male",Full,50 Years,3.00,3.00,-1550.87,United States,2003,-2181.43
3086,A cost-effectiveness analysis of fluvastatin in patients with diabetes after successful percutaneous coronary intervention,"BACKGROUND: The Lescol Intervention Prevention Study (LIPS) was a multinational randomized controlled trial that showed a 47% reduction in the relative risk of cardiac death and a 22% reduction in major adverse cardiac events (MACEs) from the routine use of fluvastatin, compared with controls, in patients undergoing percutaneous coronary intervention (PCI, defined as angioplasty with or without stents). In this study, MACEs included cardiac death, nonfatal myocardial infarction, and subsequent PCI and coronary artery bypass graft. Diabetes was the greatest risk factor for MACEs. OBJECTIVE: This study estimated the cost-effectiveness of fluvastatin when used for secondary prevention of MACEs after PCI in people with diabetes. METHODS: A post hoc subgroup analysis of patients with diabetes from the LIPS was used to estimate the effectiveness of fluvastatin in reducing myocardial infarction, revascularization, and cardiac death. A probabilistic Markov model was developed using United Kingdom resource and cost data to estimate the additional costs and quality-adjusted life-years (QALYs) gained over 10 years from the perspective of the British National Health Service. The model contained 6 health states, and the transition probabilities were derived from the LIPS data. Crossover from fluvastatin to other lipid-lowering drugs, withdrawal from fluvastatin, and the use of lipid-lowering drugs in the control group were included. RESULTS: In the subgroup of 202 patients with diabetes in the LIPS trial, 18 (15.0%) of 120 fluastatin patients and 21 (25.6%) of 82 control participants were insulin dependent (P = NS). Compared with the control group, patients treated with fluvastatin can expect to gain an additional mean (SD) of 0.196 (0.139) QALY per patient over 10 years (P < 0.001) and will cost the health service an additional mean (SD) of 10 pounds ( 448 pounds) (P = NS) (mean [SD] US $16 [$689]). The additional cost per QALY gained was 51 pounds (US $78). The key determinants of cost-effectiveness included the probabilities of repeat interventions, cardiac death, the cost of fluvastatin, and the time horizon used for the evaluation. CONCLUSION: Fluvastatin was an economically efficient treatment to prevent MACEs in these patients with diabetes undergoing PCI.",2005-01-01602,16291420,Clin Ther,Paul A Scuffham,2005,27 / 9,1467-77,Yes,16291420,"Paul A Scuffham; Stephen Chaplin; Stephen Chaplin; A cost-effectiveness analysis of fluvastatin in patients with diabetes after successful percutaneous coronary intervention, Clin Ther, 2005-Sep; 27(9):1879-114X; 1467-77",QALY,Not Stated,Not Stated,Not Stated,Fluvastatin plus dietary and lifestyle counseling vs. Counseling only,Not Stated,Not Stated,Not Stated,"Female, Male",Full,10 Years,3.50,3.50,51,United Kingdom,2002,110.24
3087,Erectile dysfunction in spinal cord injury: a cost-utility analysis,"BACKGROUND: There is a high incidence of erectile dysfunction after spinal cord injury. This can have a profound effect on quality of life. Treatment options for erectile dysfunction include sildenafil, intracavernous injections of papaverine/alprostadil (Caverject), alprostadil/papaverine/phentolamine (""Triple Mix""), transurethral suppository (MUSE), surgically implanted prosthetic device and vacuum erection devices. However, physical impairments and accessibility may preclude patient self-utilization of non-oral treatments. METHODS: The costs and utilities of oral and non-oral erectile dysfunction treatments in a spinal cord injury population were examined in a cost-utility analysis conducted from a government payer perspective. Subjects with spinal cord injury (n=59) reported health preferences using the standard gamble technique. RESULTS: There was a higher health preference for oral therapy. The cost-effectiveness results indicated that sildenafil was the dominant economic strategy when compared with surgically implanted prosthetic devices, MUSE(R) and Caverject. The incremental cost-utility ratios comparing sildenafil with triple mix and vacuum erection devices favoured sildenafil, with ratios less than CAN$20,000 per quality adjusted life year gained. CONCLUSION: Based on this study, we conclude that sildenafil is a cost-effective treatment for erectile dysfunction in the spinal cord injury population.",2005-01-01604,16287667,J Rehabil Med,Nicole Mittmann,2005,37 / 6,358-64,No,16287667,"Nicole Mittmann; B Catherine Craven; Michael Gordon; D H Robert MacMillan; Magdy Hassouna; Warren Raynard; Anita Kaiser; L Krista Lanctôt; Jean-Eric Tarride; B Catherine Craven; Michael Gordon; D H Robert MacMillan; Magdy Hassouna; Warren Raynard; Anita Kaiser; L Krista Lanctôt; Jean-Eric Tarride; Erectile dysfunction in spinal cord injury: a cost-utility analysis, J Rehabil Med, 2005-Nov; 37(6):1650-1977; 358-64",QALY,Not Stated,Not Stated,Not Stated,Sildenafil for erectile dysfunction vs. Caverject intracavernous injection,Not Stated,55 Years,18 Years,Male,Full,1 Year,Not Stated,Not Stated,-5348,Canada,2001,-5047.87
