33329,Cost-effectiveness of implementing 13-valent pneumococcal conjugate vaccine for U.S. adults aged 19 years and older with underlying conditions,"In June 2019, the Advisory Committee on Immunization Practices (ACIP) changed the recommendation for routine 13-valent pneumococcal conjugate vaccine (PCV13) use in immunocompetent adults aged =65 years, including those with select chronic medical conditions (CMC). ACIP now recommends PCV13 for this group of adults based on shared clinical decision-making. Because adults with CMC continue to be at increased risk for pneumococcal disease, we assessed the cost-effectiveness of administering PCV13 in series with the recommended 23-valent pneumococcal polysaccharide vaccine (PPSV23) for adults aged =19 years with CMC. We used a probabilistic model following a cohort of 19-year-old adults. We used Monte Carlo simulation to estimate the impact on program, medical, and non-medical costs (in 2017 U.S. dollars [$], societal perspective), and pneumococcal disease burden when administering PCV13 in series with PPSV23. We used PCV13 efficacy and post-licensure vaccine effectiveness (VE) data to estimate VE against PCV13 type disease (separately for disease by serotype 3 [ST3], the most common PCV13 type, and all other PCV13 serotypes). We considered a range of estimates for sensitivity analyses. Analyses were performed in 2019. In the base case, assuming no PCV13 effectiveness against ST3 disease, adding a dose of PCV13 upon CMC diagnosis cost $689,299 per QALY gained. This declined to $79,416 per QALY if VE against ST3 was estimated to be equivalent to other PCV13-types. Administering PCV13 in series with the recommended PPSV23 for adults with CMC was not cost saving. Results were sensitive to estimated PCV13 VE against ST3 disease.",2021-01-35560,33499718,Hum Vaccin Immunother,Miwako Kobayashi,2021,/,1-9,No,33499718,"Miwako Kobayashi; Charles Stoecker; Wei Xing; Bo-Hyun Cho; Tamara Pilishvili; Cost-effectiveness of implementing 13-valent pneumococcal conjugate vaccine for U.S. adults aged 19 years and older with underlying conditions, Hum Vaccin Immunother , 2021 Feb 25; ():2164-554X; 1-9",QALY,United States of America,"Bacterial, viral and other infectious agents",Immunization,13-valent pneumococcal conjugate vaccine vs. No 13-valent pneumococcal conjugate vaccine,Patients with underlying conditions,Not Stated,19 Years,"Male, Female",Full,"Lifetime, Not Stated / None",3.00,3.00,689299,United States,2017,761991.47
33330,Cost-effectiveness of emicizumab vs bypassing agents in the prevention of bleeding episodes in haemophilia A patients with anti-FVIII inhibitors in France,"INTRODUCTION: The development of an anti-FVIII inhibitor is the most serious complication of haemophilia A occurring in up to 30% of severe haemophilic patients. The current management of haemophilia A with inhibitor uses bypassing agents (BPA) and represents a significant therapeutic burden together with a limited adherence to prophylactic treatment. Emicizumab is the first monoclonal antibody developed in haemophilia A approved for the prevention of bleeding episodes in patients with anti-FVIII inhibitor. AIM: The purpose of this study is to evaluate the incremental cost-effectiveness ratio (ICER) of emicizumab versus BPAs. METHODS: A Markov model was developed over a five-year time horizon to estimate the comparative costs and benefits of the different therapeutic approaches in this rare disease. Model inputs were clinical, including annual bleeding rate and quality of life, and economical including mainly costs of prophylaxis, bleeds and adverse events. RESULTS: Emicizumab treatment is dominant, ie lest costly and more effective, in the base-case analysis saving 234 191 € for a gain of 0.88 QALY. This is confirmed by both the deterministic and probabilistic sensitivity analyses. The main limit of the study remains the absence of long-term clinical data allowing to relate treatment consumption to clinical benefit, especially in the progression of haemophilic arthropathy. CONCLUSION: Our results show that emicizumab is a cost-effective treatment allowing to consider an easy to implement prophylactic treatment for haemophilia A patients with anti-FVIII inhibitors.",2021-01-35530,33210412,Haemophilia,Benoît Polack,2021,27 / 1,e1-e11,No,33210412,"Benoît Polack; Marc Trossaërt; Mathias Cousin; Sandrine Baffert; Alexandra Pruvot; Chloé Godard; Cost-effectiveness of emicizumab vs bypassing agents in the prevention of bleeding episodes in haemophilia A patients with anti-FVIII inhibitors in France, Haemophilia, 2021 Jan; 27(1):1351-8216; e1-e11",QALY,French Republic,"Coagulation defects, purpura and other haemorrhagic conditions",Pharmaceutical,Emicizumab vs. Bypassing agents,severe haemophilic patients,Not Stated,18 Years,"Male, Female",Full,"5 Years, Not Stated / None",4.00,4.00,-265793.89,Euro,2019,-315556.09
33331,Cost-Effectiveness of 4CMenB Infant Vaccination in England: A Comprehensive Valuation Considering the Broad Impact of Serogroup B Invasive Meningococcal Disease,"OBJECTIVES: This cost-effectiveness analysis (CEA) of 4CMenB infant vaccination in England comprehensively considers the broad burden of serogroup B invasive meningococcal disease (MenB IMD), which has not been considered, or was only partially considered in previous CEAs. METHODS: A review of previous MenB vaccination CEAs was conducted to identify aspects considered in the evaluation of costs and health outcomes of the disease burden of MenB IMD. To inform the model structure and comprehensive analysis, the aspects were grouped into 5 categories. A stepwise analysis was conducted to analyze the impact of each category, and the more comprehensive consideration of disease burden, on the incremental cost-effectiveness ratio (ICER). RESULTS: MenB IMD incidence decreased by 46.0% in infants and children 0-4 years old within 5 years after introduction of the program. Stepwise inclusion of the 5 disease burden categories to a conventional narrow CEA setting reduced the ICER from £360 595 to £18 645-that is, considering the impact of all 5 categories, 4CMenB infant vaccination is cost-effective at a threshold of £20 000 per QALY gained. CONCLUSIONS: When considering comprehensively the MenB IMD burden, 4CMenB infant vaccination can be cost-effective, a finding contrary to previous CEAs. This analysis allows policy decision-makers globally to infer the impact of current disease burden considerations on the cost-effectiveness and the comprehensive assessment necessary for MenB IMD. Although this comprehensive CEA can help inform decision making today, it may be limited in capturing the full disease burden and complex interactions of health and economics of MenB IMD.",2021-01-35493,33431159,Value Health,Ekkehard Beck,2021,24 / 1,91-104,Yes,33431159,"Ekkehard Beck; Johan Klint; Mohamed Neine; Stephanie Garcia; Kinga Meszaros; Kairong Wang; Jie Zhong; Na Huang; Yingfeng Zhou; Cost-Effectiveness of 4CMenB Infant Vaccination in England: A Comprehensive Valuation Considering the Broad Impact of Serogroup B Invasive Meningococcal Disease, Value Health, 2021 Jan; 24(1):1098-3015; 91-104",QALY,United Kingdom,Other bacterial diseases,Immunization,4CMenB Infant Vaccination vs. Nothing,,4 Years,0 Years,"Male, Female",Full,"100 Years, Not Stated / None",1.50,1.50,18645,United Kingdom,2019,25234.46
33332,"Cost-effectiveness of paclitaxel, doxorubicin, cyclophosphamide and trastuzumab versus docetaxel, cisplatin and trastuzumab in new adjuvant therapy of breast cancer in china","BACKGROUND: Breast cancer is the most common cancer among women in China. Amplification of the Human epidermal growth factor receptor type 2 (HER2) gene is present and overexpressed in 18-20% of breast cancers and historically has been associated with inferior disease-related outcomes. There has been increasing interest in de-escalation of therapy for low-risk disease. This study analyzes the cost-effectiveness of Doxorubicin/ Cyclophosphamide/ Paclitaxel/ Trastuzumab (AC-TH) and Docetaxel/Carboplatin/Trastuzumab(TCH) from payer perspective over a 5 year time horizon. METHODS: A half-cycle corrected Markov model was built to simulate the process of breast cancer events and death occurred in both AC-TH and TCH armed patients. Cost data came from studies based on a Chinese hospital. One-way sensitivity analyses as well as second-order Monte Carlo and probabilistic sensitivity analyses were performed.The transition probabilities and utilities were extracted from published literature, and deterministic sensitivity analyses were conducted. RESULTS: We identified 41 breast cancer patients at Hangzhou First People''s Hospital, among whom 15 (60%) had a partial response for AC-TH treatment and 13 (81.25%) had a partial response for TCH treatment.No cardiac toxicity was observed. Hematologic grade 3 or 4 toxicities were observed in 1 of 28 patients.Nonhematologic grade 3 or 4 toxicities with a reverse pattern were observed in 6 of 29 patients. The mean QALY gain per patient compared with TCH was 0.25 with AC-TH, while the incremental costs were $US13,142. The incremental cost-effectiveness ratio (ICER) of AC-TH versus TCH was $US 52,565 per QALY gained. CONCLUSIONS: This study concluded that TCH neoadjuvant chemotherapy was feasible and active in HER2-overexpressing breast cancer patients in terms of the pathological complete response, complete response, and partial response rates and manageable toxicities.",2021-01-35491,33622356,Cost Eff Resour Alloc,Qiaoping Xu,2021,19 / 1,11,Yes,33622356,"Qiaoping Xu; Li Yuanyuan; Zhu Jiejing; Liu Jian; Li Qingyu; Chen Lingya; Luo Ying; Shi Changchen; Li Yangling; Yan Wei; Cost-effectiveness of paclitaxel, doxorubicin, cyclophosphamide and trastuzumab versus docetaxel, cisplatin and trastuzumab in new adjuvant therapy of breast cancer in china, Cost Eff Resour Alloc, 2021 Jan 13; 19(1):1478-7547; 11",QALY,China,"Malignant neoplasms, breast and female genital organs",Pharmaceutical,doxorubicin + cyclophosphamide vs. docetaxel + carboplatin,Not Stated,Not Stated,18 Years,Female,Full,"5 Years, Not Stated / None",5.00,5.00,-52568,United States,2019,-55716.65
33333,A cost-effectiveness analysis of three approaches for lymph node assessment in patients with low- and intermediate-risk endometrial cancer,"OBJECTIVE: To assess the cost-effectiveness of sentinel lymph node mapping compared to risk factor assessment and routine full lymph node dissection for the assessment of lymph nodes in patients with low- and intermediate-risk endometrioid endometrial cancer. METHODS: A decision-analytic model was designed to compare three lymph node assessment strategies in terms of costs and effects: 1) sentinel lymph node mapping; 2) post-operative risk factor assessment (adjuvant therapy based on clinical and histological risk factors); 3) full lymph node dissection. Input data were derived from systematic literature searches and expert opinion. QALYs were used as measure of effectiveness. The model was built from a healthcare perspective and the impact of uncertainty was assessed with sensitivity analyses. RESULTS: Base-case analysis showed that sentinel lymph node mapping was the most effective strategy for lymph node assessment in patients with low- and intermediate-risk endometrial cancer. Compared to risk factor assessment it was more costly, but the incremental cost effectiveness ratio stayed below a willingness-to-pay threshold of €20,000 with a maximum of €9637/QALY. Sentinel lymph node mapping was dominant compared to lymph node dissection since it was more effective and less costly. Sensitivity analyses showed that the outcome of the model was robust to changes in input values. With a willingness-to-pay threshold of €20,000 sentinel lymph node mapping remained cost-effective in at least 74.3% of the iterations. CONCLUSION: Sentinel lymph node mapping is the most cost-effective strategy to guide the need for adjuvant therapy in patients with low and intermediate risk endometrioid endometrial cancer.",2021-01-35442,33581847,Gynecol Oncol,Lara C Burg,2021,/,,No,33581847,"Lara C Burg; Robin J Vermeulen; Ruud L M Bekkers; Stan R W Wijn; Maroeska M Rovers; Tim M Govers; Petra L M Zusterzeel; A cost-effectiveness analysis of three approaches for lymph node assessment in patients with low- and intermediate-risk endometrial cancer, Gynecol Oncol, 2021 Feb 10; ():0090-8258",QALY,Netherlands,"Malignant neoplasms, breast and female genital organs","Pharmaceutical, Surgical",adjuvant therapy based on bilateral and unilateral sentinel lymph node mapping vs. adjuvant therapy based on post-operative risk factor assessment,grade 1–2,65 Years,65 Years,Female,Full,"20 Years, Not Stated / None",4.00,1.50,5588,Euro,2019,6634.19
33334,A cost-effectiveness analysis of three approaches for lymph node assessment in patients with low- and intermediate-risk endometrial cancer,"OBJECTIVE: To assess the cost-effectiveness of sentinel lymph node mapping compared to risk factor assessment and routine full lymph node dissection for the assessment of lymph nodes in patients with low- and intermediate-risk endometrioid endometrial cancer. METHODS: A decision-analytic model was designed to compare three lymph node assessment strategies in terms of costs and effects: 1) sentinel lymph node mapping; 2) post-operative risk factor assessment (adjuvant therapy based on clinical and histological risk factors); 3) full lymph node dissection. Input data were derived from systematic literature searches and expert opinion. QALYs were used as measure of effectiveness. The model was built from a healthcare perspective and the impact of uncertainty was assessed with sensitivity analyses. RESULTS: Base-case analysis showed that sentinel lymph node mapping was the most effective strategy for lymph node assessment in patients with low- and intermediate-risk endometrial cancer. Compared to risk factor assessment it was more costly, but the incremental cost effectiveness ratio stayed below a willingness-to-pay threshold of €20,000 with a maximum of €9637/QALY. Sentinel lymph node mapping was dominant compared to lymph node dissection since it was more effective and less costly. Sensitivity analyses showed that the outcome of the model was robust to changes in input values. With a willingness-to-pay threshold of €20,000 sentinel lymph node mapping remained cost-effective in at least 74.3% of the iterations. CONCLUSION: Sentinel lymph node mapping is the most cost-effective strategy to guide the need for adjuvant therapy in patients with low and intermediate risk endometrioid endometrial cancer.",2021-01-35442,33581847,Gynecol Oncol,Lara C Burg,2021,/,,No,33581847,"Lara C Burg; Robin J Vermeulen; Ruud L M Bekkers; Stan R W Wijn; Maroeska M Rovers; Tim M Govers; Petra L M Zusterzeel; A cost-effectiveness analysis of three approaches for lymph node assessment in patients with low- and intermediate-risk endometrial cancer, Gynecol Oncol, 2021 Feb 10; ():0090-8258",QALY,Netherlands,"Malignant neoplasms, breast and female genital organs","Pharmaceutical, Surgical",adjuvant therapy based on bilateral sentinel lymph node mapping vs. adjuvant therapy based on post-operative risk factor assessment,grade 1–2,65 Years,65 Years,Female,Full,"20 Years, Not Stated / None",4.00,1.50,9637,Euro,2019,11441.25
33335,A cost-effectiveness analysis of three approaches for lymph node assessment in patients with low- and intermediate-risk endometrial cancer,"OBJECTIVE: To assess the cost-effectiveness of sentinel lymph node mapping compared to risk factor assessment and routine full lymph node dissection for the assessment of lymph nodes in patients with low- and intermediate-risk endometrioid endometrial cancer. METHODS: A decision-analytic model was designed to compare three lymph node assessment strategies in terms of costs and effects: 1) sentinel lymph node mapping; 2) post-operative risk factor assessment (adjuvant therapy based on clinical and histological risk factors); 3) full lymph node dissection. Input data were derived from systematic literature searches and expert opinion. QALYs were used as measure of effectiveness. The model was built from a healthcare perspective and the impact of uncertainty was assessed with sensitivity analyses. RESULTS: Base-case analysis showed that sentinel lymph node mapping was the most effective strategy for lymph node assessment in patients with low- and intermediate-risk endometrial cancer. Compared to risk factor assessment it was more costly, but the incremental cost effectiveness ratio stayed below a willingness-to-pay threshold of €20,000 with a maximum of €9637/QALY. Sentinel lymph node mapping was dominant compared to lymph node dissection since it was more effective and less costly. Sensitivity analyses showed that the outcome of the model was robust to changes in input values. With a willingness-to-pay threshold of €20,000 sentinel lymph node mapping remained cost-effective in at least 74.3% of the iterations. CONCLUSION: Sentinel lymph node mapping is the most cost-effective strategy to guide the need for adjuvant therapy in patients with low and intermediate risk endometrioid endometrial cancer.",2021-01-35442,33581847,Gynecol Oncol,Lara C Burg,2021,/,,No,33581847,"Lara C Burg; Robin J Vermeulen; Ruud L M Bekkers; Stan R W Wijn; Maroeska M Rovers; Tim M Govers; Petra L M Zusterzeel; A cost-effectiveness analysis of three approaches for lymph node assessment in patients with low- and intermediate-risk endometrial cancer, Gynecol Oncol, 2021 Feb 10; ():0090-8258",QALY,Netherlands,"Malignant neoplasms, breast and female genital organs","Pharmaceutical, Surgical",adjuvant therapy based on bilateral and unilateral sentinel lymph node mapping vs. adjuvant therapy based on full lymph node dissection,grade 1–2,65 Years,65 Years,Female,Full,"20 Years, Not Stated / None",4.00,1.50,-33715.38,Euro,2019,-40027.61
33336,A cost-effectiveness analysis of three approaches for lymph node assessment in patients with low- and intermediate-risk endometrial cancer,"OBJECTIVE: To assess the cost-effectiveness of sentinel lymph node mapping compared to risk factor assessment and routine full lymph node dissection for the assessment of lymph nodes in patients with low- and intermediate-risk endometrioid endometrial cancer. METHODS: A decision-analytic model was designed to compare three lymph node assessment strategies in terms of costs and effects: 1) sentinel lymph node mapping; 2) post-operative risk factor assessment (adjuvant therapy based on clinical and histological risk factors); 3) full lymph node dissection. Input data were derived from systematic literature searches and expert opinion. QALYs were used as measure of effectiveness. The model was built from a healthcare perspective and the impact of uncertainty was assessed with sensitivity analyses. RESULTS: Base-case analysis showed that sentinel lymph node mapping was the most effective strategy for lymph node assessment in patients with low- and intermediate-risk endometrial cancer. Compared to risk factor assessment it was more costly, but the incremental cost effectiveness ratio stayed below a willingness-to-pay threshold of €20,000 with a maximum of €9637/QALY. Sentinel lymph node mapping was dominant compared to lymph node dissection since it was more effective and less costly. Sensitivity analyses showed that the outcome of the model was robust to changes in input values. With a willingness-to-pay threshold of €20,000 sentinel lymph node mapping remained cost-effective in at least 74.3% of the iterations. CONCLUSION: Sentinel lymph node mapping is the most cost-effective strategy to guide the need for adjuvant therapy in patients with low and intermediate risk endometrioid endometrial cancer.",2021-01-35442,33581847,Gynecol Oncol,Lara C Burg,2021,/,,No,33581847,"Lara C Burg; Robin J Vermeulen; Ruud L M Bekkers; Stan R W Wijn; Maroeska M Rovers; Tim M Govers; Petra L M Zusterzeel; A cost-effectiveness analysis of three approaches for lymph node assessment in patients with low- and intermediate-risk endometrial cancer, Gynecol Oncol, 2021 Feb 10; ():0090-8258",QALY,Netherlands,"Malignant neoplasms, breast and female genital organs","Pharmaceutical, Surgical",adjuvant therapy based on post-operative risk factor assessment vs. adjuvant therapy based on full lymph node dissection,grade 1-2,65 Years,65 Years,Female,Full,"20 Years, Not Stated / None",4.00,1.50,-28916.67,Euro,2019,-34330.47
33337,Cost-utility Analysis of Rotavirus Vaccines Including the Latest Evidence and Data as of June 2020 in Japan,"BACKGROUND: In several health economic analyses of rotavirus vaccines in Japan, all were not cost-effective from the healthcare payer perspective (HPP) but generally cost-effective from the societal perspective (SP). However, few studies have incorporated clinically significant factors of vaccine herd immunity, convulsions with gastroenteritis, encephalopathies, nosocomial infections, death, and intussusception as a vaccine side effect. A cost-utility analysis incorporating these were conducted. METHODS: We used Bakir''s decision-tree model and data in Japan with 94% coverage rate, 5-year time horizon, and 2% discount. We compared the incremental cost-effectiveness ratio (ICER) with a willingness-to-pay of Japanese Yen (JPY) 5 million from HPP and SP. Scenario 1 examined items based on existing research; scenario 2 additionally examined the above-mentioned items. In scenario 2, break-even prices were determined, and one-way and probabilistic sensitivity analyses were performed. RESULTS: In scenario 1, the ICER was JPY 6,057,281 from the HPP and dominant from the SP. In scenario 2, it was JPY 3,713,488 from the HPP. From the HPP in scenario 2, break-even prices were JPY 34,227 for an ICER of JPY 5 million and JPY 17,798 for cost-saving. One-way sensitivity analysis showed ICERs fluctuated widely with ambulatory visits and vaccination costs. In the probabilistic sensitivity analysis, ICERs of 54.8% were less than the willingness-to-pay. In scenario 2, from the SP, vaccines were dominant. CONCLUSION: From the HPP in scenario 2, the vaccines were cost-effective. In the sensitivity analyses, ICERs also improved from the HPP over previous studies. Herd immunity for ambulatory visits contributed most to the decline.",2021-01-35441,33055499,Pediatr Infect Dis J,Teruyoshi Kurosawa,2021,40 / 2,162-168,No,33055499,"Teruyoshi Kurosawa; Hiroshi Watanabe; Kenzo Takahashi; Cost-utility Analysis of Rotavirus Vaccines Including the Latest Evidence and Data as of June 2020 in Japan, Pediatr Infect Dis J, 2021 Feb 1; 40(2):0891-3668; 162-168",QALY,Japan,Not Stated,Immunization,universal mass rotavirus vaccination vs. no mass rotavirus vaccination,Not Stated,5 Years,Not Stated,"Male, Female",Full,"5 Years, Not Stated / None",2.00,2.00,6057281,Japan,2020,59442.19
33338,Cost-utility Analysis of Rotavirus Vaccines Including the Latest Evidence and Data as of June 2020 in Japan,"BACKGROUND: In several health economic analyses of rotavirus vaccines in Japan, all were not cost-effective from the healthcare payer perspective (HPP) but generally cost-effective from the societal perspective (SP). However, few studies have incorporated clinically significant factors of vaccine herd immunity, convulsions with gastroenteritis, encephalopathies, nosocomial infections, death, and intussusception as a vaccine side effect. A cost-utility analysis incorporating these were conducted. METHODS: We used Bakir''s decision-tree model and data in Japan with 94% coverage rate, 5-year time horizon, and 2% discount. We compared the incremental cost-effectiveness ratio (ICER) with a willingness-to-pay of Japanese Yen (JPY) 5 million from HPP and SP. Scenario 1 examined items based on existing research; scenario 2 additionally examined the above-mentioned items. In scenario 2, break-even prices were determined, and one-way and probabilistic sensitivity analyses were performed. RESULTS: In scenario 1, the ICER was JPY 6,057,281 from the HPP and dominant from the SP. In scenario 2, it was JPY 3,713,488 from the HPP. From the HPP in scenario 2, break-even prices were JPY 34,227 for an ICER of JPY 5 million and JPY 17,798 for cost-saving. One-way sensitivity analysis showed ICERs fluctuated widely with ambulatory visits and vaccination costs. In the probabilistic sensitivity analysis, ICERs of 54.8% were less than the willingness-to-pay. In scenario 2, from the SP, vaccines were dominant. CONCLUSION: From the HPP in scenario 2, the vaccines were cost-effective. In the sensitivity analyses, ICERs also improved from the HPP over previous studies. Herd immunity for ambulatory visits contributed most to the decline.",2021-01-35441,33055499,Pediatr Infect Dis J,Teruyoshi Kurosawa,2021,40 / 2,162-168,No,33055499,"Teruyoshi Kurosawa; Hiroshi Watanabe; Kenzo Takahashi; Cost-utility Analysis of Rotavirus Vaccines Including the Latest Evidence and Data as of June 2020 in Japan, Pediatr Infect Dis J, 2021 Feb 1; 40(2):0891-3668; 162-168",QALY,Japan,Not Stated,Immunization,universal mass rotavirus vaccination vs. no universal mass rotavirus vaccination,Not Stated,5 Years,Not Stated,"Male, Female",Full,"5 Years, Not Stated / None",2.00,2.00,-7647099,Japan,2020,-75043.63
