4121,"Choosing between measures: comparison of EQ-5D, HUI2 and HUI3 in persons with hearing complaints","OBJECTIVES: To generate insight into the differences between utility measures EuroQol 5D (EQ-5D), Health Utilities Index Mark II (HUI2) and Mark III (HUI3) and their impact on the incremental cost-effectiveness ratio (ICER) for hearing aid fitting METHODS: Persons with hearing complaints completed EQ-5D, HUI2 and HUI3 at baseline and, when applicable, after hearing aid fitting. Practicality, construct validity, agreement, responsiveness and impact on the ICER were examined. RESULTS: All measures had high completion rates. HUI3 was capable of discriminating between clinically distinctive groups. Utility scores (n = 315) for EQ-5D UK and Dutch tariff (0.83; 0.86), HUI2 (0.77) and HUI3 (0.61) were significantly different, agreement was low to moderate. Change after hearing aid fitting (n = 70) for HUI2 (0.07) and HUI3 (0.12) was statistically significant, unlike the EQ-5D UK (0.01) and Dutch (0.00) tariff. ICERs varied from 647,209 euros/QALY for the EQ-5D Dutch tariff to 15,811 euros/QALY for HUI3. CONCLUSION: Utility scores, utility gain and ICERs heavily depend on the measure that is used to elicit them. This study indicates HUI3 as the instrument of first choice when measuring utility in a population with hearing complaints, but emphasizes the importance of a clear notion of what constitutes utility with regard to economic analyses.",2007-01-03190,17647093,Qual Life Res,Janneke P C Grutters,2007,16 / 8,1439-49,No,17647093,"Janneke P C Grutters; Manuela A Joore; Frans van der Horst; Hans Verschuure; Wouter A Dreschler; Lucien J C Anteunis; Choosing between measures: comparison of EQ-5D, HUI2 and HUI3 in persons with hearing complaints, Qual Life Res, 2007-Oct; 16(8):0962-9343; 1439-49",QALY,Not Stated,Not Stated,Not Stated,Hearing aid fitting vs. No fitting,Not Stated,Not Stated,Not Stated,"Female, Male",Full,1 Year,Not Stated,Not Stated,25337,Euro,2005,41798.43
4122,"Choosing between measures: comparison of EQ-5D, HUI2 and HUI3 in persons with hearing complaints","OBJECTIVES: To generate insight into the differences between utility measures EuroQol 5D (EQ-5D), Health Utilities Index Mark II (HUI2) and Mark III (HUI3) and their impact on the incremental cost-effectiveness ratio (ICER) for hearing aid fitting METHODS: Persons with hearing complaints completed EQ-5D, HUI2 and HUI3 at baseline and, when applicable, after hearing aid fitting. Practicality, construct validity, agreement, responsiveness and impact on the ICER were examined. RESULTS: All measures had high completion rates. HUI3 was capable of discriminating between clinically distinctive groups. Utility scores (n = 315) for EQ-5D UK and Dutch tariff (0.83; 0.86), HUI2 (0.77) and HUI3 (0.61) were significantly different, agreement was low to moderate. Change after hearing aid fitting (n = 70) for HUI2 (0.07) and HUI3 (0.12) was statistically significant, unlike the EQ-5D UK (0.01) and Dutch (0.00) tariff. ICERs varied from 647,209 euros/QALY for the EQ-5D Dutch tariff to 15,811 euros/QALY for HUI3. CONCLUSION: Utility scores, utility gain and ICERs heavily depend on the measure that is used to elicit them. This study indicates HUI3 as the instrument of first choice when measuring utility in a population with hearing complaints, but emphasizes the importance of a clear notion of what constitutes utility with regard to economic analyses.",2007-01-03190,17647093,Qual Life Res,Janneke P C Grutters,2007,16 / 8,1439-49,No,17647093,"Janneke P C Grutters; Manuela A Joore; Frans van der Horst; Hans Verschuure; Wouter A Dreschler; Lucien J C Anteunis; Choosing between measures: comparison of EQ-5D, HUI2 and HUI3 in persons with hearing complaints, Qual Life Res, 2007-Oct; 16(8):0962-9343; 1439-49",QALY,Not Stated,Not Stated,Not Stated,Hearing aid fitting vs. No fitting,Not Stated,Not Stated,Not Stated,"Female, Male",Full,1 Year,Not Stated,Not Stated,15811,Euro,2005,26083.4
4123,Assessing differences in utility scores: a comparison of four widely used preference-based instruments,"OBJECTIVES: To characterize the differences in utility scores (dUTY) among four commonly used preference-based Health-Related Quality of Life instruments, to evaluate the potential impact of these differences on cost-utility analyses (CUA), and to determine if sociodemographic/clinical factors influenced the magnitude of these differences. METHODS: Consenting adult Chinese, Malay and Indian subjects in Singapore were interviewed using Singapore English, Chinese, Malay or Tamil versions of the EQ-5D, Health Utilities Index Mark 2 (HUI2) and Mark 3 (HUI3), and SF-6D. Agreement between instruments was assessed using Bland-Altman (BA) plots. Changes in incremental cost-utility ratio (ICUR) from dUTY were investigated using eight hypothetical decision trees. The influence of sociodemographic/clinical factors on dUTY between instrument pairs was studied using multiple linear regression (MLR) models for English-speaking subjects (circumventing structural zero issues). RESULTS: In 667 subjects (median age 48 years, 59% female), median utility scores ranged from 0.80 (95% confidence interval [CI] 0.80, 0.85) for the EQ-5D to 0.89 (95% CI 0.88, 0.89) for the SF-6D. BA plots: Mean differences (95% CI) exceeded the clinically important difference (CID) of 0.04 for four of six pairwise comparisons, with the exception of the HUI2/EQ-5D (0.03, CI: 0.02, 0.04) and SF-6D/HUI2 (0.02, CI: 0.006, 0.02). Decision trees: The ICER ranged from $94,661/QALY (quality-adjusted life-year; 6.3% difference from base case) to 100,693 dollars/QALY (0.3% difference from base case). MLR: Chronic medical conditions, marital status, and Family Functioning Measures scores significantly (P-value < 0.05) influenced dUTY for several instrument pairs. CONCLUSION: Although CIDs in utility measurements were present for different preference-based instruments, the impact of these differences on CUA appeared relatively minor. Chronic medical conditions, marital status, and family functioning influenced the magnitude of these differences.",2007-01-03192,17645680,Value Health,Hwee-Lin Wee,2007,10 / 4,256-65,Yes,17645680,"Hwee-Lin Wee; David Machin; Wai-Chiong Loke; Shu-Chuen Li; Yin-Bun Cheung; Nan Luo; David Feeny; Kok-Yong Fong; Julian Thumboo; Assessing differences in utility scores: a comparison of four widely used preference-based instruments, Value Health, 2007 Jul-Aug; 10(4):1098-3015; 256-65",QALY,Not Stated,Not Stated,Not Stated,Drug A vs. Drug B,Not Stated,Not Stated,Not Stated,"Female, Male",Full,Not Stated / None,Not Stated,Not Stated,100972,United States,2005,133807.8
4124,Economic evaluation of tegaserod vs. placebo in the treatment of patients with irritable bowel syndrome: an analysis of the TENOR study,"OBJECTIVES: Tegaserod is effective, safe, and well-tolerated in the treatment of patients with irritable bowel syndrome (IBS) with constipation. The aim of this study was to assess, from a payer perspective, the cost-effectiveness of tegaserod in the treatment of IBS patients, based on the TEgaserod in NORdic region (TENOR) trial data. METHODS: Female and male patients (Rome II criteria) were randomized to receive tegaserod 6 mg b.i.d. or placebo for 12 weeks. Patients (247 tegaserod; 238 placebo) completed the EuroQol EQ-5D questionnaire at baseline, Week 4, and Week 12. A 12-week economic study was undertaken to assess the incremental cost-effectiveness ratio (ICER) of tegaserod in terms of cost per quality-adjusted life-year (QALY) gained. Cost-effectiveness acceptability curves were calculated to estimate the probability of tegaserod being cost-effective at different benchmark values of cost per QALY gained. RESULTS: By assuming a daily drug cost to payers of Euro 2, Euro 3, and Euro 4, the ICER of tegaserod ranges between Euro 19,000 and Euro 38,000 per QALY gained, with the percentage of the bootstrap estimates below the willingness to pay level of Euro 50,000 per QALY gained ranging between 90% and 69%. CONCLUSIONS: This study established directly from a randomized controlled clinical trial that tegaserod is cost-effective in the treatment of non-D-IBS patients.",2007-01-03193,17645678,Value Health,Andrea Bracco,2007,10 / 4,238-46,Yes,17645678,"Andrea Bracco; Bengt Jönsson; Jean-Francois Ricci; Michael Drummond; Henry Nyhlin; Economic evaluation of tegaserod vs. placebo in the treatment of patients with irritable bowel syndrome: an analysis of the TENOR study, Value Health, 2007 Jul-Aug; 10(4):1098-3015; 238-46",QALY,Not Stated,Not Stated,Not Stated,Tegaserod 6 mg b.i.d. vs. Placebo,Not Stated,Not Stated,Not Stated,"Female, Male",Full,12 Weeks,Not Stated,Not Stated,19000,Euro,2005,31344.29
4125,Medicare's quality improvement organization program value in nursing homes,"CMS operates the quality improvement organization (QIO) program to improve the quality of care delivered to Medicare beneficiaries. Although there have been several studies regarding the effectiveness of this program, there have not been studies regarding this program's value. This article seeks to answer the value question using costutility analysis. Although additional research is warranted, the results suggest that CMS' investment in the QIO program, estimated at $2,063 to $7,667 per quality-adjusted life year (QALY) gained for nursing home quality improvement (QI) work, represents a good value for health care dollars.",2007-01-03194,17645159,Health Care Financ Rev,Anthony Shih,2007,28 / 3,109-16,No,17645159,"Anthony Shih; Diane M Dewar; Thomas Hartman; Medicare's quality improvement organization program value in nursing homes, Health Care Financ Rev, 2007; 28(3):0195-8631; 109-16",QALY,Not Stated,Not Stated,Not Stated,Quality improvement organization (QIO) program vs. No program,Not Stated,Not Stated,Not Stated,"Female, Male",Full,2 Years,Not Stated,Not Stated,3577,United States,2005,4740.23
4126,Quality of life and cost-effectiveness of acupuncture treatment in patients with osteoarthritis pain,"To assess quality of life (QoL), costs, and cost-effectiveness of acupuncture treatment plus routine care versus routine care alone in osteoarthritis patients, a randomised, controlled trial was conducted in 255 general practices in Germany. Four hundred and eighty-nine patients with chronic pain due to osteoarthritis of the knee or hip were included to evaluated QoL and costs at baseline and after 3 months using health insurance funds data and standardized questionnaires. Patients receiving acupuncture had an improved QoL associated with significantly higher costs over the 3 months treatment period compared to routine care alone (mean cost-difference: <euro>469.50 [95%CI <euro>135.80-<euro>803.19]). This increase in costs was primarily due to the costs of acupuncture. The overall ICER was <euro>17,845 per QALY gained. The degree of cost-effectiveness was influenced by gender, with female patients achieving a better cost-effectiveness ratio than men. In conclusion, acupuncture was a cost-effective treatment strategy in patients with chronic osteoarthritis pain.",2007-01-03200,17638034,Eur J Health Econ,Thomas Reinhold,2007,/,,Yes,17638034,"Thomas Reinhold; Claudia Witt; Susanne Jena; Benno Brinkhaus; Stefan Willich; Claudia M Witt; Susanne Jena; Benno Brinkhaus; Stefan N Willich; Quality of life and cost-effectiveness of acupuncture treatment in patients with osteoarthritis pain, Eur J Health Econ, 2007-Jul-19; ():1618-7598",QALY,Not Stated,Not Stated,Not Stated,Acupuncture vs. No acupuncture,Not Stated,Not Stated,Not Stated,"Female, Male",Full,3 Months,Not Stated,Not Stated,17845,Euro,2005,29438.88
4127,Cost-effectiveness of Spa treatment for fibromyalgia: general health improvement is not for free,"OBJECTIVES: To estimate the cost-effectiveness of an adjuvant treatment course of spa treatment compared with usual care only in patients with fibromyalgia syndrome (FM). METHODS: 134 patients with FM, selected from a rheumatology outpatient department and from members of the Dutch FM patient association were randomly assigned to a 2(1/2) week spa treatment course in Tunisia or to usual care only. Results are expressed as quality-adjusted life years (QALYs) for a 6-month as well as a 12-month time horizon. Utilities were derived form the Short Form 6D (SF-6D) scores and the visual analogue scale (VAS) rating general health. Costs were reported from societal perspective. Mean incremental cost per patient and the incremental cost utility ratio (ICER) were calculated; 95% confidence intervals (CIs) were estimated using double-sided bootstrapping. RESULTS: The data of 128 (55 spa and 73 controls) of the 134 patients (96%) could be used for analysis. Improvement in general health was found in the spa group until 6 months of follow-up by both the SF-6D (AUC 0.32 vs 0.30, P < 0.05) and the VAS (AUC 0.23 vs 0.19, P < 0.01). After 1yr no significant between-group differences were found. Mean incremental cost of spa treatment was 1311 Euro per patient (95% CI 369-2439), equalling the cost of the intervention (thalassotherapy including airfare and lodging), or 885 Euro per patient based on a more realistic cost estimate. CONCLUSIONS: The temporary improvement in quality of life due to an adjuvant treatment course of spa therapy for patients with FM is associated with limited incremental costs per patient.",2007-01-03202,17636181,Rheumatology (Oxford),T R Zijlstra,2007,46 / 9,1454-9,No,17636181,"T R Zijlstra; L M A Braakman-Jansen; E Taal; J J Rasker; M A F J van de Laar; Cost-effectiveness of Spa treatment for fibromyalgia: general health improvement is not for free, Rheumatology (Oxford), 2007-Sep; 46(9):1462-0324; 1454-9",QALY,Not Stated,Not Stated,Not Stated,Spa treatment vs. Usual care,Not Stated,65 Years,18 Years,"Female, Male",Full,6 Months,Not Stated,Not Stated,32775,Euro,2000,45475.75
4128,Cost-effectiveness of suppressing hepatitis B virus DNA in immune tolerant patients to prevent hepatocellular carcinoma and cirrhosis,"BACKGROUND: For patients with hepatitis B virus (HBV) infection in the immune tolerant phase, the current standard of care is to not offer treatment. However, the recent Risk Evaluation of the Viral Load Elevation and Associated Liver Disease/Cancer-In study results show a striking relationship between high HBV DNA levels and risk for hepatocellular carcinoma and cirrhosis. AIM: In a cost effectiveness analysis, to assess whether immune tolerant patients with high HBV DNA levels should undergo treatment. METHODS: We created a lifetime Markov model to evaluate the cost-effectiveness of two strategies for immune tolerant hepatitis B: (i) HBV DNA suppression with lamivudine, (ii) no treatment. Patients cycled between the following health states: viral suppression, ongoing viremia, seroconversion, hepatocellular carcinoma, cirrhosis and death. RESULTS: Compared with the no treatment strategy, lamivudine therapy was more expensive but more cost-effective with an additional cost of $5784 and $12 584 per quality adjusted life year gained in males and females, respectively. Treatment resulted in a gain in life expectancy and a decrease in lifetime risk of hepatocellular carcinoma and cirrhosis. CONCLUSIONS: Suppressing HBV DNA to prevent hepatocellular carcinoma and cirrhosis in immune tolerant patients is very cost-effective, and treatment of these patients may be considered. Future prospective clinical trials will need to be undertaken to confirm our findings.",2007-01-03203,17635373,Aliment Pharmacol Ther,A D Enriquez,2007,26 / 3,383-91,No,17635373,"A D Enriquez; M S Campbell; K R Reddy; Cost-effectiveness of suppressing hepatitis B virus DNA in immune tolerant patients to prevent hepatocellular carcinoma and cirrhosis, Aliment Pharmacol Ther, 2007-Aug-01; 26(3):0269-2813; 383-91",QALY,Not Stated,Not Stated,Not Stated,HBV DNA suppression with lamivudine vs. No treatment,Not Stated,Not Stated,Not Stated,Female,Full,Lifetime,3.00,3.00,12584,United States,2006,16155.15
4129,Cost-effectiveness of suppressing hepatitis B virus DNA in immune tolerant patients to prevent hepatocellular carcinoma and cirrhosis,"BACKGROUND: For patients with hepatitis B virus (HBV) infection in the immune tolerant phase, the current standard of care is to not offer treatment. However, the recent Risk Evaluation of the Viral Load Elevation and Associated Liver Disease/Cancer-In study results show a striking relationship between high HBV DNA levels and risk for hepatocellular carcinoma and cirrhosis. AIM: In a cost effectiveness analysis, to assess whether immune tolerant patients with high HBV DNA levels should undergo treatment. METHODS: We created a lifetime Markov model to evaluate the cost-effectiveness of two strategies for immune tolerant hepatitis B: (i) HBV DNA suppression with lamivudine, (ii) no treatment. Patients cycled between the following health states: viral suppression, ongoing viremia, seroconversion, hepatocellular carcinoma, cirrhosis and death. RESULTS: Compared with the no treatment strategy, lamivudine therapy was more expensive but more cost-effective with an additional cost of $5784 and $12 584 per quality adjusted life year gained in males and females, respectively. Treatment resulted in a gain in life expectancy and a decrease in lifetime risk of hepatocellular carcinoma and cirrhosis. CONCLUSIONS: Suppressing HBV DNA to prevent hepatocellular carcinoma and cirrhosis in immune tolerant patients is very cost-effective, and treatment of these patients may be considered. Future prospective clinical trials will need to be undertaken to confirm our findings.",2007-01-03203,17635373,Aliment Pharmacol Ther,A D Enriquez,2007,26 / 3,383-91,No,17635373,"A D Enriquez; M S Campbell; K R Reddy; Cost-effectiveness of suppressing hepatitis B virus DNA in immune tolerant patients to prevent hepatocellular carcinoma and cirrhosis, Aliment Pharmacol Ther, 2007-Aug-01; 26(3):0269-2813; 383-91",QALY,Not Stated,Not Stated,Not Stated,HBV DNA suppression with lamivudine vs. No treatment,Not Stated,Not Stated,Not Stated,Male,Full,Lifetime,3.00,3.00,5784,United States,2006,7425.41
4130,Cost-effectiveness of peginterferon alpha-2a compared with lamivudine treatment in patients with HBe-antigen-positive chronic hepatitis B in the United Kingdom,"BACKGROUND: Peginterferon alpha-2a (40 kDa), a new treatment for chronic hepatitis B, produces seroconversion within 48 weeks in approximately 32% of HBeAg-positive patients. Over a defined treatment duration it offers improved efficacy over lamivudine, but at higher cost. We assessed the clinical outcomes and costs, from the perspective of the UK National Health Service, of 48 weeks of peginterferon alpha-2a (40 kDa) vs. 4 years of lamivudine. METHODS: Cost-effectiveness was analysed using a state-transition Markov model simulating HBeAg-positive chronic hepatitis B natural history. Efficacy data were obtained from a large randomized trial comparing peginterferon alpha-2a (40 kDa) with lamivudine over 48 weeks. Use of adefovir salvage treatment for lamivudine-resistant patients was also evaluated. Long-term lamivudine efficacy, treatment durability, disease progression, cost, and quality-of-life estimates were derived from the literature. One-way and probabilistic sensitivity analyses evaluated uncertainty. RESULTS: Treatment with peginterferon alpha-2a (40 kDa) for 48 weeks resulted in higher discounted total healthcare costs ( pound 3100), but an increase of 0.3 discounted quality-adjusted life years compared with long-term lamivudine, giving an incremental cost-effectiveness ratio of pound 10,400 per quality-adjusted life year gained ( pound 8300- pound 15,400 in one-way sensitivity analyses). The cost-effectiveness acceptability curve showed intervention was below the pound 30,000/QALY threshold in over 95% of the simulations. When adefovir was included for patients with lamivudine resistance, peginterferon alpha-2a (40 kDa) had an incremental cost of pound 6100/QALY gained. CONCLUSIONS: Treatment with peginterferon alpha-2a (40 kDa) for a defined duration of 48 weeks, although more expensive than lamivudine therapy, provides improvement in health outcomes, with a cost-effectiveness ratio well below the current UK cost-effectiveness threshold.",2007-01-03210,17625431,Eur J Gastroenterol Hepatol,David L Veenstra,2007,19 / 8,631-8,No,17625431,"David L Veenstra; Sean D Sullivan; Geoffry M Dusheiko; Michael Jacobs; Julia E Aledort; Gavin Lewis; Kavita K Patel; Cost-effectiveness of peginterferon alpha-2a compared with lamivudine treatment in patients with HBe-antigen-positive chronic hepatitis B in the United Kingdom, Eur J Gastroenterol Hepatol, 2007-Aug; 19(8):0954-691X; 631-8",QALY,United Kingdom,Not Stated,Not Stated,Peginterferon a-2a 180 mg monotherapy for 48 weeks vs. Lamivudine 100 mg monotherapy up to a maximum of 4 years or until patients achieve HBeAg seroconversion,Not Stated,32 Years,32 Years,"Female, Male",Full,Lifetime,6.00,1.50,10444,United Kingdom,2005,25194.61
4131,"Cost-effectiveness analysis of anastrozole vs tamoxifen in adjuvant therapy for early stage breast cancer in the United Kingdom: the 5-year completed treatment analysis of the ATAC ('Arimidex', Tamoxifen alone or in combination) trial","Results from the completed treatment analysis of the ATAC (Arimidex, Tamoxifen alone or in combination) trial indicated that anastrozole was significantly superior to tamoxifen in terms of efficacy and safety in the adjuvant treatment of postmenopausal women with hormone receptor-positive (HR+) early breast cancer. On the basis of these results, this study estimated the cost-effectiveness of anastrozole vs tamoxifen, from the perspective of the UK National Health Service (NHS). A Markov model was developed using the 5-year completed treatment analysis from the ATAC trial (ISRCTN18233230), as well as data obtained from published literature and expert opinion. Resource utilisation data and associated costs (2003-4 UK pound) were compiled from standard sources and expert opinion. Utility scores for a number of health states were obtained from a cross-sectional study of 26 representative patients using the standard gamble technique. The utility scores were then inserted into the model to obtain cost per quality adjusted life-year (QALY) gained. Costs and benefits were discounted at recommended annual rates of the UK Treasury (3.5%). Modelled for 25 years, anastrozole, relative to generic tamoxifen, was estimated to result in 0.244 QALYs gained per patient at an additional cost of pound4315 per patient). The estimated incremental cost-effectiveness of anastrozole compared with tamoxifen was pound17 656 per QALY gained. There was a greater than 90% probability that the cost-effectiveness of anastrozole was below pound30 000 per QALY gained and of the order of 65% that it was below pound20 000 per QALY gained. The results were robust to all parameters tested in sensitivity analysis. Compared with commonly accepted thresholds, anastrozole is a cost-effective alternative to generic tamoxifen in adjuvant treatment of postmenopausal women with HR+ early breast cancer from the UK NHS perspective.",2007-01-03213,17622238,Br J Cancer,R Mansel,2007,97 / 2,152-61,No,17622238,"R Mansel; G Locker; L Fallowfield; A Benedict; D Jones; Cost-effectiveness analysis of anastrozole vs tamoxifen in adjuvant therapy for early stage breast cancer in the United Kingdom: the 5-year completed treatment analysis of the ATAC ('Arimidex', Tamoxifen alone or in combination) trial, Br J Cancer, 2007-Jul-16; 97(2):0007-0920; 152-61",QALY,Not Stated,Not Stated,Not Stated,Anastrozole vs. Tamoxifen,Not Stated,Not Stated,Not Stated,Female,Full,25 Years,3.50,3.50,17656,United Kingdom,2004,44340.99
