6241,Cost effectiveness of COX 2 selective inhibitors and traditional NSAIDs alone or in combination with a proton pump inhibitor for people with osteoarthritis,"OBJECTIVES: To investigate the cost effectiveness of cyclo-oxygenase-2 (COX 2) selective inhibitors and traditional non-steroidal anti-inflammatory drugs (NSAIDs), and the addition of proton pump inhibitors to these treatments, for people with osteoarthritis. DESIGN: An economic evaluation using a Markov model and data from a systematic review was conducted. Estimates of cardiovascular and gastrointestinal adverse events were based on data from three large randomised controlled trials, and observational data were used for sensitivity analyses. Efficacy benefits from treatment were estimated from a meta-analysis of trials reporting total Western Ontario and McMaster Universities (WOMAC) osteoarthritis index score. Other model inputs were obtained from the relevant literature. The model was run for a hypothetical population of people with osteoarthritis. Subgroup analyses were conducted for people at high risk of gastrointestinal or cardiovascular adverse events. Comparators Licensed COX 2 selective inhibitors (celecoxib and etoricoxib) and traditional NSAIDs (diclofenac, ibuprofen, and naproxen) for which suitable data were available were compared. Paracetamol was also included, as was the possibility of adding a proton pump inhibitor (omeprazole) to each treatment. MAIN OUTCOME MEASURES: The main outcome measure was cost effectiveness, which was based on quality adjusted life years gained. Quality adjusted life year scores were calculated from pooled estimates of efficacy and major adverse events (that is, dyspepsia; symptomatic ulcer; complicated gastrointestinal perforation, ulcer, or bleed; myocardial infarction; stroke; and heart failure). RESULTS: Addition of a proton pump inhibitor to both COX 2 selective inhibitors and traditional NSAIDs was highly cost effective for all patient groups considered (incremental cost effectiveness ratio less than pound1000 (euro1175, $1650)). This finding was robust across a wide range of effectiveness estimates if the cheapest proton pump inhibitor was used. In our base case analysis, adding a proton pump inhibitor to a COX 2 selective inhibitor (used at the lowest licensed dose) was a cost effective option, even for patients at low risk of gastrointestinal adverse events (incremental cost effectiveness ratio approximately pound10 000). Uncertainties around relative adverse event rates meant relative cost effectiveness for individual COX 2 selective inhibitors and traditional NSAIDs was difficult to determine. CONCLUSIONS: Prescribing a proton pump inhibitor for people with osteoarthritis who are taking a traditional NSAID or COX 2 selective inhibitor is cost effective. The cost effectiveness analysis was sensitive to adverse event data and the specific choice of COX 2 selective inhibitor or NSAID agent should, therefore, take into account individual cardiovascular and gastrointestinal risks.",2009-01-05601,19602530,BMJ,Nicholas Latimer,2009,339 /,b2538,No,19602530,"Nicholas Latimer; Joanne Lord; Robert L Grant; Rachel O'Mahony; John Dickson; Philip G Conaghan; Cost effectiveness of COX 2 selective inhibitors and traditional NSAIDs alone or in combination with a proton pump inhibitor for people with osteoarthritis, BMJ, 2009; 339():0959-8138; b2538",QALY,United Kingdom,Not Stated,Not Stated,Etoricoxib (30 mg) plus proton pump inhibitor vs. Diclofenac (100 mg) plus proton pump inhibitor,Not Stated,55 Years,55 Years,"Female, Male",Full,Lifetime,3.50,3.50,7472,United Kingdom,2007,18672.23
6242,Cost effectiveness of COX 2 selective inhibitors and traditional NSAIDs alone or in combination with a proton pump inhibitor for people with osteoarthritis,"OBJECTIVES: To investigate the cost effectiveness of cyclo-oxygenase-2 (COX 2) selective inhibitors and traditional non-steroidal anti-inflammatory drugs (NSAIDs), and the addition of proton pump inhibitors to these treatments, for people with osteoarthritis. DESIGN: An economic evaluation using a Markov model and data from a systematic review was conducted. Estimates of cardiovascular and gastrointestinal adverse events were based on data from three large randomised controlled trials, and observational data were used for sensitivity analyses. Efficacy benefits from treatment were estimated from a meta-analysis of trials reporting total Western Ontario and McMaster Universities (WOMAC) osteoarthritis index score. Other model inputs were obtained from the relevant literature. The model was run for a hypothetical population of people with osteoarthritis. Subgroup analyses were conducted for people at high risk of gastrointestinal or cardiovascular adverse events. Comparators Licensed COX 2 selective inhibitors (celecoxib and etoricoxib) and traditional NSAIDs (diclofenac, ibuprofen, and naproxen) for which suitable data were available were compared. Paracetamol was also included, as was the possibility of adding a proton pump inhibitor (omeprazole) to each treatment. MAIN OUTCOME MEASURES: The main outcome measure was cost effectiveness, which was based on quality adjusted life years gained. Quality adjusted life year scores were calculated from pooled estimates of efficacy and major adverse events (that is, dyspepsia; symptomatic ulcer; complicated gastrointestinal perforation, ulcer, or bleed; myocardial infarction; stroke; and heart failure). RESULTS: Addition of a proton pump inhibitor to both COX 2 selective inhibitors and traditional NSAIDs was highly cost effective for all patient groups considered (incremental cost effectiveness ratio less than pound1000 (euro1175, $1650)). This finding was robust across a wide range of effectiveness estimates if the cheapest proton pump inhibitor was used. In our base case analysis, adding a proton pump inhibitor to a COX 2 selective inhibitor (used at the lowest licensed dose) was a cost effective option, even for patients at low risk of gastrointestinal adverse events (incremental cost effectiveness ratio approximately pound10 000). Uncertainties around relative adverse event rates meant relative cost effectiveness for individual COX 2 selective inhibitors and traditional NSAIDs was difficult to determine. CONCLUSIONS: Prescribing a proton pump inhibitor for people with osteoarthritis who are taking a traditional NSAID or COX 2 selective inhibitor is cost effective. The cost effectiveness analysis was sensitive to adverse event data and the specific choice of COX 2 selective inhibitor or NSAID agent should, therefore, take into account individual cardiovascular and gastrointestinal risks.",2009-01-05601,19602530,BMJ,Nicholas Latimer,2009,339 /,b2538,No,19602530,"Nicholas Latimer; Joanne Lord; Robert L Grant; Rachel O'Mahony; John Dickson; Philip G Conaghan; Cost effectiveness of COX 2 selective inhibitors and traditional NSAIDs alone or in combination with a proton pump inhibitor for people with osteoarthritis, BMJ, 2009; 339():0959-8138; b2538",QALY,United Kingdom,Not Stated,Not Stated,Celecoxib (200 mg) plus proton pump inhibitor vs. Etoricoxib (30 mg) plus proton pump inhibitor,Not Stated,55 Years,55 Years,"Female, Male",Full,Lifetime,3.50,3.50,10745,United Kingdom,2007,26851.32
6243,Is INTERdisicplinary COMmunity-based COPD management (INTERCOM) cost-effective?,"The study aimed to estimate the cost-effectiveness of interdisciplinary community-based COPD management in patients with COPD.We conducted a cost-effectiveness analysis alongside a two-year randomized controlled trial, in which 199 patients with less advanced airflow obstruction and impaired exercise capacity were assigned to the INTERCOM program or usual care. The INTERCOM program consisted of exercise training, education, nutritional therapy and smoking cessation counselling offered by community-based physiotherapists and dieticians and hospital-based respiratory nurses. Two-year all-cause resource use was obtained by self-report and from hospital and pharmacy records. Health outcomes were the St. George's-Respiratory-Questionnaire (SGRQ), exacerbations and Quality-Adjusted Life Years (QALYs).The INTERCOM group had 30% (95%CI:3-56%) more patients with a clinically relevant improvement in SGRQ total score, 0.08 (95%CI:-0.01-0.18) more QALYs per patient, but a higher mean number of exacerbations, 0.84 (95%CI:-0.07-1.78). Mean total two-year costs were euro2,751 (95%CI:-632-6,372) higher for INTERCOM than for usual care, which resulted in an incremental cost-effectiveness ratio of euro9,078 per additional patient with a relevant improvement in SGRQ or euro32,425 per QALY.INTERCOM significantly improved disease-specific quality of life, but did not affect exacerbation rate. The cost per QALY ratio was moderate, but within the range of what is generally considered to be acceptable.",2009-01-05612,19574331,Eur Respir J,M Hoogendoorn,2009,/,,No,19574331,"M Hoogendoorn; C R van Wetering; A M Schols; M P M H Rutten-van Mölken; Is INTERdisicplinary COMmunity-based COPD management (INTERCOM) cost-effective?, Eur Respir J, 2009-Jul-02; ():0903-1936",QALY,Netherlands,Not Stated,Not Stated,"INTERCOM program: interdisciplinary community based COPD management program including exercise training, education, nutritional therapy and smoking cessation counselling vs. Usual care: pharmacotherapy according to accepted guidelines, a short smoking cessation advice by their respiratory physician and short nutritional advice to eat more and better in case they were nutritionally depleted",Not Stated,Not Stated,Not Stated,"Female, Male",Full,2 Years,Not Stated,Not Stated,32425,Euro,2007,55492.32
6244,Is INTERdisicplinary COMmunity-based COPD management (INTERCOM) cost-effective?,"The study aimed to estimate the cost-effectiveness of interdisciplinary community-based COPD management in patients with COPD.We conducted a cost-effectiveness analysis alongside a two-year randomized controlled trial, in which 199 patients with less advanced airflow obstruction and impaired exercise capacity were assigned to the INTERCOM program or usual care. The INTERCOM program consisted of exercise training, education, nutritional therapy and smoking cessation counselling offered by community-based physiotherapists and dieticians and hospital-based respiratory nurses. Two-year all-cause resource use was obtained by self-report and from hospital and pharmacy records. Health outcomes were the St. George's-Respiratory-Questionnaire (SGRQ), exacerbations and Quality-Adjusted Life Years (QALYs).The INTERCOM group had 30% (95%CI:3-56%) more patients with a clinically relevant improvement in SGRQ total score, 0.08 (95%CI:-0.01-0.18) more QALYs per patient, but a higher mean number of exacerbations, 0.84 (95%CI:-0.07-1.78). Mean total two-year costs were euro2,751 (95%CI:-632-6,372) higher for INTERCOM than for usual care, which resulted in an incremental cost-effectiveness ratio of euro9,078 per additional patient with a relevant improvement in SGRQ or euro32,425 per QALY.INTERCOM significantly improved disease-specific quality of life, but did not affect exacerbation rate. The cost per QALY ratio was moderate, but within the range of what is generally considered to be acceptable.",2009-01-05612,19574331,Eur Respir J,M Hoogendoorn,2009,/,,No,19574331,"M Hoogendoorn; C R van Wetering; A M Schols; M P M H Rutten-van Mölken; Is INTERdisicplinary COMmunity-based COPD management (INTERCOM) cost-effective?, Eur Respir J, 2009-Jul-02; ():0903-1936",QALY,Netherlands,Not Stated,Not Stated,"INTERCOM program: interdisciplinary community based COPD management program including exercise training, education, nutritional therapy and smoking cessation counselling vs. Usual care: pharmacotherapy according to accepted guidelines, a short smoking cessation advice by their respiratory physician and short nutritional advice to eat more and better in case they were nutritionally depleted",Not Stated,Not Stated,Not Stated,"Female, Male",Full,2 Years,Not Stated,Not Stated,25309,Euro,2007,43313.96
6245,Cost-effectiveness analysis of human papillomavirus vaccination in the Netherlands,"BACKGROUND: In the Netherlands, low cervical cancer incidence and mortality rates might limit the cost-effectiveness of vaccination against the human papillomavirus (HPV). We examined the effect on cervical cancer incidence and mortality of adding HPV vaccination to the current Dutch cervical cancer screening situation and calculated the cost-effectiveness. METHODS: Costs and effects were estimated under favorable assumptions (ie, that HPV vaccination provides lifelong protection against 70% of all cervical cancers, has no side effects, and is administered to all women regardless of their risk of cervical cancer) by using the microsimulation screening analysis (MISCAN) model. The impact of changes in the price of vaccination, number of booster vaccinations, vaccination attendance rate, vaccination efficacy, cervical cancer incidence level, and quality-of-life assumptions was investigated in sensitivity analyses. RESULTS: Using the current price of euro118 per vaccine dose and with discounting of costs and effects at an annual rate of 3%, adding HPV vaccination to the current Dutch screening situation had a cost-effectiveness ratio of euro53 500 per quality-adjusted life-year (QALY) gained. The threshold price per vaccine dose at which the cost-effectiveness of vaccination would correspond to an acceptability threshold of euro20 000 per QALY gained was euro40. With the addition of one or more (up to four) booster vaccinations during a lifetime, this threshold price decreased to euro33 for one booster (to euro16 for four boosters). With a doubling of the cervical cancer incidence level, the cost-effectiveness ratio was euro24 400 per QALY gained and the maximum price per dose at threshold of euro20 000 was euro97. All threshold prices were lower under less favorable effectiveness assumptions. CONCLUSIONS: In the Netherlands, HPV vaccination is not cost-effective even under favorable assumptions. To become cost-effective, the vaccine price would have to be decreased considerably, depending on the effectiveness of the vaccine.",2009-01-05618,19571256,J Natl Cancer Inst,Inge M C M de Kok,2009,101 / 15,1083-92,No,19571256,"Inge M C M de Kok; Marjolein van Ballegooijen; J Dik F Habbema; Cost-effectiveness analysis of human papillomavirus vaccination in the Netherlands, J Natl Cancer Inst, 2009-Aug-05; 101(15):0027-8874; 1083-92",QALY,Netherlands,Not Stated,Not Stated,Vaccinated for human papilloma virus (HPV) plus screening for cervical cancer vs. Cervical cancer screening only,Not Stated,12 Years,12 Years,Female,Full,Lifetime,3.00,3.00,53500,Euro,2007,91560.18
6246,Assessing the value of atomoxetine in treating children and adolescents with ADHD in the UK,"BACKGROUND: Economic evaluation of healthcare technologies is becoming increasingly relevant, enabling decision makers to assess and compare treatments within the context of costs and outcomes. Moreover, it is increasingly important for clinicians and prescribers to have some understanding of economic evaluation. For attention-deficit/hyperactivity disorder (ADHD), economic evaluations have largely focused on pharmacotherapy, and results indicate that such treatments are cost-effective compared with other interventions. AIMS: This review provides an overview of ADHD, its consequences and pharmacotherapy; describes the principles of health economic analysis, health-related quality of life (HRQL) and a cost-effectiveness model of atomoxetine for ADHD treatment; and outlines guidance from the National Institute for Health and Clinical Excellence on ADHD pharmacotherapy. METHODS: The cost-effectiveness of atomoxetine for children with ADHD in the UK was compared with treatment alternatives using an economic model with Markov processes. The model evaluated atomoxetine in five patient subgroups according to treatment history and comorbidities precluding stimulants. Incremental cost per quality-adjusted life-year (QALY) was calculated and compared between treatment algorithms. The Markov process incorporated 18 health states, representing a range of outcomes across the treatments. Utility values were derived from a survey of 83 parents of children with ADHD, and treatment efficacy and safety were based on a review of controlled clinical trials and literature, and validated by international experts. Costs and outcomes were estimated using Monte Carlo simulation over 1-year. RESULTS: Atomoxetine was a cost-effective treatment across the whole ADHD population, with incremental cost-effectiveness ratios ranging from pound 11,500 to pound 15,900 per QALY, compared with alternative pharmacotherapies, which are within UK and rest of Europe acceptability limits. Higher utility values achieved treating ADHD with atomoxetine, compensate for the relatively higher acquisition cost compared with stimulants. CONCLUSIONS: Atomoxetine is cost-effective and may have advantages over stimulants, including benefits to HRQL and no abuse liability and is the only treatment in the UK licensed for continued treatment into adulthood in adolescents who have shown a response from treatment.",2009-01-05620,19570121,Int J Clin Pract,S Prasad,2009,63 / 7,1031-40,No,19570121,"S Prasad; J Arellano; C Steer; S E Libretto; Assessing the value of atomoxetine in treating children and adolescents with ADHD in the UK, Int J Clin Pract, 2009-Jul; 63(7):1368-5031; 1031-40",QALY,United Kingdom,Not Stated,Not Stated,Atomoxetine vs. Immediate release methylphenidate (IR-MPH),Not Stated,Not Stated,Not Stated,"Female, Male",Full,1 Year,Not Stated,Not Stated,15224,United Kingdom,2004,38233.3
6247,Assessing the value of atomoxetine in treating children and adolescents with ADHD in the UK,"BACKGROUND: Economic evaluation of healthcare technologies is becoming increasingly relevant, enabling decision makers to assess and compare treatments within the context of costs and outcomes. Moreover, it is increasingly important for clinicians and prescribers to have some understanding of economic evaluation. For attention-deficit/hyperactivity disorder (ADHD), economic evaluations have largely focused on pharmacotherapy, and results indicate that such treatments are cost-effective compared with other interventions. AIMS: This review provides an overview of ADHD, its consequences and pharmacotherapy; describes the principles of health economic analysis, health-related quality of life (HRQL) and a cost-effectiveness model of atomoxetine for ADHD treatment; and outlines guidance from the National Institute for Health and Clinical Excellence on ADHD pharmacotherapy. METHODS: The cost-effectiveness of atomoxetine for children with ADHD in the UK was compared with treatment alternatives using an economic model with Markov processes. The model evaluated atomoxetine in five patient subgroups according to treatment history and comorbidities precluding stimulants. Incremental cost per quality-adjusted life-year (QALY) was calculated and compared between treatment algorithms. The Markov process incorporated 18 health states, representing a range of outcomes across the treatments. Utility values were derived from a survey of 83 parents of children with ADHD, and treatment efficacy and safety were based on a review of controlled clinical trials and literature, and validated by international experts. Costs and outcomes were estimated using Monte Carlo simulation over 1-year. RESULTS: Atomoxetine was a cost-effective treatment across the whole ADHD population, with incremental cost-effectiveness ratios ranging from pound 11,500 to pound 15,900 per QALY, compared with alternative pharmacotherapies, which are within UK and rest of Europe acceptability limits. Higher utility values achieved treating ADHD with atomoxetine, compensate for the relatively higher acquisition cost compared with stimulants. CONCLUSIONS: Atomoxetine is cost-effective and may have advantages over stimulants, including benefits to HRQL and no abuse liability and is the only treatment in the UK licensed for continued treatment into adulthood in adolescents who have shown a response from treatment.",2009-01-05620,19570121,Int J Clin Pract,S Prasad,2009,63 / 7,1031-40,No,19570121,"S Prasad; J Arellano; C Steer; S E Libretto; Assessing the value of atomoxetine in treating children and adolescents with ADHD in the UK, Int J Clin Pract, 2009-Jul; 63(7):1368-5031; 1031-40",QALY,United Kingdom,Not Stated,Not Stated,Atomoxetine vs. Extended release methylphenidate (IR-MPH),Not Stated,Not Stated,Not Stated,"Female, Male",Full,1 Year,Not Stated,Not Stated,13241,United Kingdom,2004,33253.23
6248,Assessing the value of atomoxetine in treating children and adolescents with ADHD in the UK,"BACKGROUND: Economic evaluation of healthcare technologies is becoming increasingly relevant, enabling decision makers to assess and compare treatments within the context of costs and outcomes. Moreover, it is increasingly important for clinicians and prescribers to have some understanding of economic evaluation. For attention-deficit/hyperactivity disorder (ADHD), economic evaluations have largely focused on pharmacotherapy, and results indicate that such treatments are cost-effective compared with other interventions. AIMS: This review provides an overview of ADHD, its consequences and pharmacotherapy; describes the principles of health economic analysis, health-related quality of life (HRQL) and a cost-effectiveness model of atomoxetine for ADHD treatment; and outlines guidance from the National Institute for Health and Clinical Excellence on ADHD pharmacotherapy. METHODS: The cost-effectiveness of atomoxetine for children with ADHD in the UK was compared with treatment alternatives using an economic model with Markov processes. The model evaluated atomoxetine in five patient subgroups according to treatment history and comorbidities precluding stimulants. Incremental cost per quality-adjusted life-year (QALY) was calculated and compared between treatment algorithms. The Markov process incorporated 18 health states, representing a range of outcomes across the treatments. Utility values were derived from a survey of 83 parents of children with ADHD, and treatment efficacy and safety were based on a review of controlled clinical trials and literature, and validated by international experts. Costs and outcomes were estimated using Monte Carlo simulation over 1-year. RESULTS: Atomoxetine was a cost-effective treatment across the whole ADHD population, with incremental cost-effectiveness ratios ranging from pound 11,500 to pound 15,900 per QALY, compared with alternative pharmacotherapies, which are within UK and rest of Europe acceptability limits. Higher utility values achieved treating ADHD with atomoxetine, compensate for the relatively higher acquisition cost compared with stimulants. CONCLUSIONS: Atomoxetine is cost-effective and may have advantages over stimulants, including benefits to HRQL and no abuse liability and is the only treatment in the UK licensed for continued treatment into adulthood in adolescents who have shown a response from treatment.",2009-01-05620,19570121,Int J Clin Pract,S Prasad,2009,63 / 7,1031-40,No,19570121,"S Prasad; J Arellano; C Steer; S E Libretto; Assessing the value of atomoxetine in treating children and adolescents with ADHD in the UK, Int J Clin Pract, 2009-Jul; 63(7):1368-5031; 1031-40",QALY,United Kingdom,Not Stated,Not Stated,Atomoxetine vs. Dexamfetamine,Not Stated,Not Stated,Not Stated,"Female, Male",Full,1 Year,Not Stated,Not Stated,14945,United Kingdom,2004,37532.63
